品牌,商品,价格,购买人数
润德大药房旗舰店,vitrakvi复合小分子肽活性肽正品胶原大豆蛋白肽粉饮料旗舰店xc,118,76
三得利健康海外旗舰店,【约150天量】suntory三得利第四代蜜露珂娜高浓度胶原蛋白粉抗糖,1726,76
汤臣倍健众华朗臣专卖店,汤臣倍健yep小粉瓶胶原蛋白液态饮正品口服液小分子肽精华饮官网,245,76
芯芯正品日本代购,捷克CM胶原蛋白粉肽粉1oo%纯冰川鳕鱼弹性细嫩易吸收collamedic,425,76
雅培特医营养品旗舰店,雅培益力佳SR营养配方粉控糖含蛋白质粉辅助降血糖低GI官方旗舰店,178,76
悠悠养生滋补店,900g汤臣倍健蛋白粉营养粉双蛋白450g2罐中老年儿童男女增强 免疫,248,76
钟意食品屋,深谷溪田益生菌驼奶蛋白粉中老年成人营养奶粉男女儿童青新疆骆驼,11,76
Healthy sunshine 全球好物,Bioe澳洲进口胶原蛋白肽奶粉燕窝Bio-e成年女士胶原饮粉collaoen,159,77
奥威特保健品专营店,MUSCLETECH肌肉科技正氮乳清蛋白粉8磅粉营养粉塑形,738,77
环嫣海外专营店,美国安利纽崔莱蛋白质粉豌豆小麦免疫力植物蛋白粉美国原装进口,183,77
美国卡歌国际总部店,卡歌胶原蛋白肽粉液态饮500d小分子纯原材料官方正品可搭葡萄籽,168,77
南苜蓿保健品专营店,燕窝胶原蛋白质营养粉增强女性搭免疫力血压低补品官方旗舰店正品,88,77
汤臣倍健乐力店,汤臣倍健蛋白粉营养蛋白质粉礼盒装男女成人中老年高蛋白600g,196,77
天猫超市,九芝堂乳清蛋白粉增强免疫力中老年人术后女性送礼官方旗舰正品店,199,77
天猫超市,汤臣倍健蛋白质粉男性女性成人补品植物蛋白营养粉官方正品,271,77
天美健官方旗舰店,【年卡】天美健胶原蛋白肽饮多肽高浓度小分子口服液保健官方正品,1399,77
欣维安保健食品专营店,健蓓高学生营养早餐奶昔粉蛋白代餐奶昔饱腹粉蛋白营养冲泡,99,77
晏婴精品,24年6月到期临期特价蛋白粉益生菌高钙鹿乳蛋白粉320克正品,11,77
正品保婴上海直销,优莎纳钙维生素D大豆蛋白粉 USANA优莎娜 葆婴葆苾康官网正品,259,77
Microingredients海外旗舰店,美国原装自然石榴汁粉鞣花酸精华去黄褐内调补气养血靓肤抗自由基,338,78
MuscleLAB,ON/奥普帝蒙/欧普特蒙WHEY金牌金标乳清蛋白质粉5磅 健身运动增肌,238,78
NutritionRite海外旗舰店,美国进口jarrow乳铁蛋白成人中老年免疫力保健猫咪乳铁蛋白粉胶囊,246,78
oo小小健康生活馆oo,实发2罐共800g】康恩贝蛋白粉 乳清蛋白质粉增强免疫中老年营养粉,78,78
vivanaturals海外旗舰店,viva加拿大进口collagen胶原蛋白肽粉口服牛胶小分子水解饮品454g,285,78
阿里健康大药房,养生堂蛋白粉官方正品中老年人乳清大豆蛋白质粉增强免疫力旗舰店,468,78
百合康旗舰店,百合康蛋白粉增强免疫力中老年人青年学营生养动植物双蛋白旗舰店,25,78
兵王的补剂营,奥普帝蒙ON蛋白粉WHEY运动增肌健身乳清蛋白质粉美国5磅,439,78
嘉禾阳光欢乐购,安利蛋白粉纽崔莱多种植物蛋白营养粉770g原装蛋白质粉孕妇中老年,497,78
名人补剂,名人补剂肌肉科技增肌粉7磅瘦人增肌增重男女健身运动营养蛋白粉,145,78
南苜蓿保健品专营店,同仁堂乳清无糖蛋白质营养粉中老年人增强免疫力官方旗舰店正品补,133,78
纽迪希亚特医营养品旗舰店,新版纽太特深度水解乳清蛋白配方粉450g*6罐食物蛋白过敏婴儿适用,2028,78
尚旺保健品专营店,猴头菇蛋白质粉中老年人提高增强营养搭免疫力养胃官方旗舰店正品,103,78
施元旗舰店,施元中老年人蛋白质粉动植物混合蛋白滋补礼品高钙植物乳清营养粉,128,78
BANNYDEER旗舰店,BD能量bcaa支链氨基酸【4:1:1】健身补剂增健肌蛋白质粉非肌酸,49,79
Codeage海外旗舰店,Codeage铂金胶原蛋白肽粉复合维生素生物素胶原蛋白精华饮,364,79
Geetop海外专营店,蛋白质营养粉免疫力看病人营养品中老年人化疗手术后恢复基能增强,170,79
SAHSwissAlpHealth海外旗舰店,瑞士SAH鱼胶原蛋白肽大粉盒口服玻尿酸无激素水解小分子女性专属,1209,79
Ythree海外旗舰店,澳洲swisse晚安胶原蛋白肽粉抗美颜衰老助眠斯维诗口服旗舰店正品,119,79
宸子妈澳洲购,Swisse乳清蛋白粉成人健身增肌增重中老年孕妇斯维诗混合蛋白质粉,169,79
大青蛙营养俱乐部,康宝莱奶昔 官网旗艦店正品 代餐奶昔 蛋白粉 混合饮料蛋白质粉,733,79
禾颐物语健康管理,汤臣倍健蛋白粉450g儿童中老年男女免疫力乳清蛋白营养粉蛋白质粉,244,79
健本堂大药房旗舰店,诺方洲氨基酸蛋白质粉复合蛋白固体饮料1000g/罐正品旗舰店rt,99,79
老伟的皇冠补剂店,赛霸肌酸粉纯一水肌酸粉300g男女健身增健肌蛋白粉爆发力耐力塞霸,35,79
诺特兰德汉庸专卖店,诺特兰德增肌粉乳清蛋白粉瘦人增重蛋白质官方旗舰店官网正品洛特,119,79
汤臣倍健健领专卖店,汤臣倍健蛋白粉营养蛋白质粉增强免疫力中老年人女官方旗舰店正品,241,79
天猫国际自营全球超级店,【自营】Orgain傲感草饲牛胶原蛋白肽粉454g小分子易吸收原装进口,279,79
益多健康食品,减专用压缩饼干健身粗粮代餐肥吃的非0脂肪无糖户外解馋小零食,28,79
远子的补剂铺,CTD真实果粒乳清蛋白质粉5磅/6磅whey冲击肌波健身补剂 非熊猫ON,109,79
mtswild旗舰店,mtswild曼滋威奥分离乳清蛋白粉蛋白质粉男女运动健康蛋白增肌粉,8,80
swisse聚优库专卖店,Swisse斯维诗玻尿酸胶原蛋白肽粉小分子正品粉剂官方旗舰店水光粉,198,80
百康保健品专营店,加量送！汤臣倍健蛋白粉 动植物双蛋白质营养粉中老年人男女无糖,119,80
常乐运动补剂商城,肌肉科技六星益生菌增肌粉乳清蛋白质瘦人增重运动健身增肌粉,40,80
哈贝高保健品旗舰店,买1发4拒绝暴利】胶原蛋白肽粉水解男女口服液液态饮品精华饮正品,59,80
奈氏力斯营养保健授权店,新西兰进口奈氏力斯naturies中老年人蛋白粉营养恢复补充蛋白质,366,80
上健协严选店,液体氮泵福建体考包小红瓶神器黑科技长跑爆发力耐力肌肉科技短跑,12,80
为粉丝开的店FOR FANS THE STORE,北欧海盗至纯肌酸粉300g爆发力耐力男蛋白粉健身增肌粉补剂非氮泵,80,80
喜来寿二号店,安利纽崔莱蛋白粉770G多种植物蛋白粉增强孕妇中老年成人免疫力,438,80
小隆人正品补剂商城,临期英国进口CNP分离乳清蛋白粉熊猫乳清蛋白11磅蛋白质增肌粉,118,80
雅姿莱旗舰店,鱼胶原蛋白三肽玻尿酸胶原蛋白粉精华液法国胶原小分子弹性蛋白肽,99,80
野兔先生正品运动营养,诺特兰德TG增肌粉瘦人增肌增重蛋白增肌粉乳清蛋白粉健身3.6磅5磅,76,80
POLA海外旗舰店,日本宝丽POLA胶原蛋白粉90包口服胶原蛋白肽紧致淡纹官方正品,848,81
VitalProteins保健品海外旗舰店,雀巢VitalProteins美国进口歪头蛋白鱼胶原蛋白肽221g粉剂2罐,769,81
草本上品,国产康宝莱奶昔基础套餐 饱腹代餐粉 蛋白质营养粉官网原装正品,864,81
环保超市生活馆,美乐家熊宝宝营养蛋白粉草莓味焦糖牛奶味450g正品非官方旗舰店,119,81
健民大药房旗舰店,雅培全安素麦香味术后全营养医学配方粉成人混合蛋白质营养粉,228,81
天猫超市,同仁堂蛋白粉5袋增强免疫力成人中老年男女性乳清营养品独立便携,39,81
天猫国际自营全球超级店,【自营】港版雅培进口怡保康糖尿病人中老年营养粉稳血糖控糖850g,248,81
星辰保健品特卖店,汤臣倍健双蛋白粉蛋白质营养正品老年人男女性免疫力药房同款增强,136,81
营养品服务中心,立适康乳清蛋白质粉香草味固体饮料300g院线同款正品保证当天发,198,81
Chodown肆吃补剂,Muscletech肌肉科技金标正氮乳清蛋白粉高性能WHEY健身运动增肌粉,215,82
muscletech官方旗舰店,Muscletech肌肉科技金装正氮乳清蛋白粉增肌粉营养粉增肌塑形,458,82
阿里健康大药房海外店,GLGFAS美国进口骨折骨裂恢复药营养品术后补钙促进骨骼愈合蛋白粉,268,82
康全特医保健品专营店,德国原装进口膳力达水解乳清蛋白质粉动物短肽不含大豆pronitrio,510,82
欧妮品质生活馆,【自用分享】 捷克挪威collamedic冰川鳕鱼胶原蛋白粉肽分子吸收,425,82
天猫超市,北京同仁堂蛋白粉乳清分离胶原蛋白粉儿童老人增强免疫力官方正品,158,82
天猫超市,麦金利乳铁蛋白乳清蛋白质粉营养中老年人增强免疫力成人儿童提高,320,82
悟健运动商贸,OXYENERGY氧气能量乳清蛋白粉ISO分离乳清whey蛋白质粉健身5磅,198,82
常乐运动补剂商城,诺特兰德三重蛋白质乳清蛋白粉450g运动健身增肌粉营养粉whey1磅,48,83
健美黑军健美补剂正品店,BD必第能量分离乳清蛋白粉4磅whey高蛋白乳清健身男运动ISO增肌,259,83
康比特体育科技旗舰店,康比特益生菌乳清蛋白粉蛋白增肌粉分离乳清蛋白质粉男女增肌塑形,429,83
汤臣倍健保健食品特惠店,汤臣倍健蛋白质粉营养蛋白粉增强 免疫力礼盒中老年人女旗舰正品,415,83
汤臣倍健食品旗舰店,汤臣倍健小金罐复合蛋白质粉乳清成人女性营养礼盒官方旗舰店正品,259,83
微溺晓笑 专注胶原蛋白,全多维效鱼胶原蛋白肽复合粉弹性蛋白深海小分子三肽抗糖化玻尿酸,166,83
益多健康食品,适合减吃的主食香煎鸡排鸡胸肉减脂餐专用奥尔良冷冻半成品肥代餐,37,83
长寿大药房旗舰店,顺丰包邮 力存优太特殊医学用途全营养配方食品乳清蛋白质粉 CS,348,83
muscletech官方旗舰店,肌肉科技六星益生菌乳清蛋白粉增肌粉分离纯乳清蛋白质健身高营养,168,84
阿里健康大药房,蛋白粉中老年营养蛋白质粉免疫球蛋白增强非免疫力官方旗舰店正品,40,84
豹哥的补剂店,豹哥补剂 奥普帝蒙ON蛋白粉WHEY运动增肌健身乳清蛋白质粉美国2磅,233,84
神龟运动营养补剂店,北欧海盗分离乳清蛋白粉便携装小袋装益生菌试用装蛋白增肌粉whey,49,84
天猫国际健研馆,【自营】美国ON奥普帝蒙金标乳清蛋白粉运动健身蛋白增肌粉5磅,538,84
维生素百货店,广药白云山敬修堂中老年人钙铁锌人参虫草乳清蛋白粉无蔗糖型正品,75,84
为粉丝开的店FOR FANS THE STORE,康比特乳清蛋白粉450g cpt蛋白质粉男女运动健身增健肌粉控脂塑型,84,84
熙运医疗器械专营店,极美刻黑豆复合粉蛋白粉孕妇备孕黑豆浆营养孕前吃科学配比冲饮Z,39,84
远子的补剂铺,远子的补剂铺凯文黄金牛肉分离蛋白粉4.4磅健身增肌92%蛋白质,255,84
众心百姓大药房旗舰,同仁堂胶原蛋白肽液态饮正品口服液燕窝烟酰胺肽粉饮品官方旗舰店,29,84
Bsn旗舰店,BSN必胜Syntha-6乳清蛋白质粉六重矩阵健身运动营养WHEY蛋白粉5磅,398,85
muscletech健氧专卖店,肌肉科技bcaa支链氨基酸肌酸氮泵健身补剂增肌蛋白粉支链氨氨基酸,248,85
阿里健康大药房,汤臣倍健胶原蛋白肽官方旗舰店正品yep液态饮口服液鱼小分子肽粉,99,85
恒健大药房旗舰店,汤臣倍健乳清小金罐蛋白质粉中老年人增强免疫力官旗方舰店正品,47,85
火山运动营养,肌肉科技六星分离乳清蛋白粉健身运动分离乳清蛋白增肌蛋白质健身,200,85
名人补剂,名人补剂GNC健安喜乳清蛋白粉 健身运动增肌分离蛋白质粉营养粉男,59,85
苏宁易购官方旗舰店,蛋白粉营养官方旗舰店正品蛋白质粉增强免疫力中老年人营养品1639,76,85
汤臣倍健官方旗舰店,汤臣倍健Yep小粉瓶胶原蛋白肽果味饮料液态饮口服美容液袋装便携,139,85
亦花集旗舰店,汤臣倍健蛋白营养粉女性老年人增强免疫力蛋白质粉官方旗舰店正品,129,85
muscletech官方旗舰店,肌肉科技bcaa支链氨基酸肌酸氮泵健身补剂增肌蛋白粉支链氨基酸,251,86
nutrasumma海外旗舰店,Nutrasumma纽特舒玛豌豆蛋白粉成人植物蛋白无麸质素食无乳糖原味,448,86
prosupps旗舰店,【限时特惠】海德力精炼乳清蛋白质粉瘦人健身营养粉增肌粉男whey,349,86
阿里健康大药房,肌肉科技六星益生菌增肌粉纯乳清蛋白粉质瘦人增重健肌官方旗舰店,69,86
澳新康品牌店,【恩佳专享】澳新康烟酰胺胶原蛋白三肽固体饮料,299,86
靓美妍旗舰店,靓美妍烟酰胺胶原蛋白肽粉液态饮正品口服液燕窝小分子肽蛋白饮,59,86
天猫超市,fiboo代餐奶昔粉蛋白代餐饱腹食品早晚餐营养主食速食冲饮代餐粉,199,86
同仁誉和堂健康生活馆,白蛋白口服液增强老年人免疫力儿童口服液白蛋白肽营养素饮品原液,78,86
纤妍保健食品专营店,阿胶红枣女性蛋白质营养粉血压低非气血不足补品官方旗舰店正品,78,86
小果锅代购,迪拜雅培全安素蛋白粉成人营养奶粉850g 新加坡原装进口正品包邮,142,86
药都仁和康枚婷专卖店,白蛋白口服液增强中老年人搭免疫力人血放化疗后营养品血蛋白补充,98,86
BD能量站,BD必第能量乳清蛋白健身蛋白质粉男女用非赛霸欧普蛋白粉增肌粉5,99,87
奥健补剂,STT怪兽支链氨基酸bcaa谷氨酰胺牛磺酸健身非乳清蛋白粉肌酸氮泵,38,87
肠内营养,康怡多分离乳清蛋白质粉术后恢复营养品中老年人原味动物蛋白质粉,378,87
基能营养品牌店,kingneng基能营养粉乳清蛋白复合粉术后放化放疗补品营养粉中老年,1580,87
食麦郎旗舰店,钙铁锌蛋白质粉中老年人增强搭免疫力补钙骨质疏松奶粉官方旗舰店,93,87
苏宁易购官方旗舰店,康恩贝蛋白粉无糖乳清蛋白质粉增强免疫力女性中老年人旗舰店3094,109,87
御济堂大药房旗舰店,斯维诗swisse官方旗舰店正品胶原蛋白肽小分子口服玻尿酸水光粉CS,29,87
Myprotein海外旗舰店,Myprotein谷氨酰胺健身粉缓解肌肉酸痛养胃食品 可搭配肌酸蛋白粉,95,88
爱昔俱乐部,康宝莱大袋奶昔国产正品官网代餐粉红豆薏苡仁康宝莱大袋装奶昔,799,88
铂品健康旗舰店,铂品乳清蛋白粉2磅健身增重健肌粉男女营养whey蛋白质粉75%,73,88
朵颜朵姿保健品旗舰店,4盒烟酰胺胶原蛋白液态饮肽粉正品玻尿酸小分子口服精华液旗舰店,29,88
华北普世德旗舰店,华北制药蛋白质粉无糖蛋白粉中老年人女士植物大豆营养粉术后补品,115,88
九洲大药房旗舰店,【0元入会】雅培全安素900g官方旗舰店蛋白质全营养成人奶粉进口,279,88
康比特体育科技旗舰店,康比特益生菌乳清蛋白粉蛋白增肌粉分离乳清蛋白质粉男女增肌塑形,429,88
企业直销云店,安利纽崔莱儿童高蛋白粉营养强草莓味940g提升儿体质强壮身体,320,88
种善堂大药房旗舰店,江中蛋白粉中老年人增强免疫力分离乳清蛋白质营养官方旗舰店正品,94,88
julieschoice海外旗舰店,julie's choice高光小粉条全身内调去黄美白饮维生素c谷胱甘肽60%,141,89
华药耀佳旗舰店,华北制药蛋白质粉1200g 成人中老年动植物混合蛋白粉增强营养正品,145,89
麦斯通保健用品专营店,儿童成长钙铁锌蛋白质营养粉增强搭免疫力提高官方旗舰店正品奶粉,85,89
十月茉莉健康馆,纽特舒玛分离乳清蛋白质粉术后营养健康中老年人成人官方进口正品,588,89
无限极INFINITUS线上店,无限极乐姿乐言蛋白质粉多多源适餐粉官方正品旗舰店保健品无极限,249,89
药都仁和康枚婷专卖店,白蛋白口服液增强中老年人搭免疫力人血放化疗后营养品血蛋白补充,98,89
中国黑老大的地盘,美国ALLMAX高纯分离乳清蛋白质粉isoflex健身增肌肉00健肌粉5磅,358,89
姿美健康堂,姿美堂胶原蛋白肽粉液态饮正品口服液精华饮品旗舰店小分子片燕窝,89,89
KEEP MOMENT直营店企业店,KEEP MOMENT分离乳清蛋白4磅乳清增肌高蛋白质粉健身营养粉抹茶,279,90
阿里健康大药房,同仁堂胶原蛋白肽液态饮口服液紧致燕窝粉分子饮品官方旗舰店正品,118,90
阿里健康大药房,胶原蛋白液态饮正品口服原液提拉紧致美燕窝肽粉白饮品官方旗舰店,168,90
北同连锁总店,北京同仁堂胶原蛋白肽口服液燕窝海参粉正品女性白官网官方旗舰店,33,90
泵铁营养商城,ON/奥普帝蒙/欧普特蒙 金牌金标乳清蛋白质粉5磅10磅增肌增重健身,233,90
德兰食品专营店,增肥增重产品蛋白质粉瘦人快速长肉变胖益生菌高保健品营养粉补品,158,90
汤臣倍健佰健专卖店,汤臣倍健乳清蛋白粉增肌蛋白质粉健身男高蛋白营养粉运动刷脂增肌,189,90
小文保健品原料,德国 嘉丽达胶原蛋白肽粉 牛皮提取 小分子多肽纯粉非液态抗糖,68,90
F by Sarah梵喜官方店,法国进口原料fbysarah深海鱼胶原蛋白肽胶原三肽精华粉小分子透亮,122,91
Keep fit  折扣超市,SUPERIOR14速比瑞斯ISO分离乳清蛋白粉健身干净增肌无糖蛋白质粉,68,91
阿里健康大药房,北京同仁堂燕窝胶原蛋白肽粉液态正品饮品小分子肽旗舰店非口服液,119,91
兵王的补剂营,MUTANT铁血魔兽ISO SURGE分离乳清蛋白粉5磅whey增肌健肌营养补剂,393,91
深谷溪田旗舰店,深谷溪田益生菌驼奶蛋白粉中老年学生儿童成人早餐营养蛋白质粉,64,91
汤臣营养品企业店,汤臣倍健蛋白粉质乳清营养粉中老年人女增强官方旗舰店免疫力正品,228,91
亦康保健食品,7袋汤 臣倍健小粉瓶胶原蛋白肽果味饮30ml（树莓朗姆酒味）便携装,46,91
中粮保健品旗舰店,可益康胶原蛋白肽液态饮正品小分子粉鱼胶原蛋白口服液官方旗舰店,218,91
卓旺旗舰店,乳清蛋白质粉增肌粉健身男女瘦人快速增肌增重长肉健肌粉,6,91
老字号品牌总店铺,北京同仁堂高钙蛋白粉袋装分离乳清蛋白营养粉官方旗舰店正品,69,92
圣卫士特医营养,领透乳清分离蛋白质粉高纯能量营养品乐透析补充粉低磷钾钠礼盒装,212,92
直销完美正品折扣店,完美牌肽藻粉营养粉早餐粉代餐粉蛋白粉营养食品实体专卖店正品,246,92
卓叔瘦人增重店,卓叔增重【好喝得不像蛋白粉】康比特CPT益生菌乳清健身增肌WHEY,379,92
intous旗舰店,LUNAB ME露比杏仁八宝pro胶原蛋白肽粉宝口服液态蛋白饮分子冲泡,59,93
老钟驾到,捷克collamedic挪威冰川鳕鱼胶原蛋白捷克纯肽分子蛋白粉,425,93
睿睿臻选,vida glow胶原蛋白肽粉鱼胶蛋白钛水解粉女精华小Q瓶,160,93
小可爱直销企业店,安利纽崔莱蛋白质粉多种植物蛋白营养粉增强孕妇中老年成人免疫力,495,93
氧气能量旗舰店,氧气能量四重乳清蛋白粉运动健身增肌粉官方旗舰店蛋白质粉便携装,199,93
卓越营养美妆店,美国产安利蛋白粉纽崔莱蛋白质粉多种植物营养儿童孕妇中老年进口,198,93
swisse锦鲤专卖店,swisse斯维诗乳清蛋白质粉成人中老年增强体质补充蛋白官方正品,418,94
爱昔俱乐部,安利蛋白质粉纽崔莱多种植物蛋白营养粉770g成人大蛋白增加免yi力,475,94
南京同仁堂  官 网,南京同仁堂营养蛋白质粉无糖增强成人免疫力官方中老年旗舰店正品,39,94
深谷溪田旗舰店,深谷溪田益生菌羊乳蛋白质粉儿童学生中老年人成人营养羊奶蛋白粉,79,94
汤臣倍健爱生活保健品店,汤臣倍健植物蛋白粉蛋白营养粉大豆蛋白质粉补品正品男女成人,257,94
友勃朗YOPRIDE商城,ALLMAX分离乳清蛋白粉ISOFLEX健身增肌粉whey无糖乳清蛋白质粉5磅,308,94
醉幻觉保健品专营店,蛋白质粉女性补品提高增强营养搭免疫力抵抗血压低官方旗舰店正品,81,94
佳帝健康医疗馆,艾申特牌蛋白粉维生素C维生素E蛋白粉420g儿童成人送礼优质双蛋白,79,95
健民大药房旗舰店,雅培全安素术后全营养特殊医学配方粉成年人蛋白质营养粉补充,228,95
立适康食品旗舰店,立适康乳清蛋白粉香草味/可可味 300克【拍五发六】,309,95
麦趣保健食品专营店,增肥增胖男性女搭产品瘦人增重快速长肉胖食品益生菌驼乳奶蛋白粉,56,95
汤臣倍健健领专卖店,汤臣倍健蛋白质粉正品男性女性补品植物蛋白粉官方旗舰店营养粉,474,95
天猫超市,汤臣倍健小金罐蛋白质粉乳清成人男女性增强蛋白营养粉官方正品店,369,95
天猫国际自营全球超级店,【自营】2罐装美国雀巢健康科学蛋白补227g/罐白蛋粉乳增肌营养粉,248,95
万有引力运动补剂,诺特兰德iso分离乳清蛋白质粉whey健身运动增肌男女纯分离乳清5磅,339,95
央企控股凯泰生物活性肽,北京凯泰深海鱼皮胶原蛋白肽粉500克600道高纯度小分子肽活性肽粉,28,95
七狼星旗舰店,氨基酸蛋白质粉增强补营养中老年人搭免疫力送父母官方旗舰店正品,70,96
阿里健康大药房,术后恢复营养品蛋白质粉 增强免疫力蛋白粉中老年人女性骨质疏松,268,97
澳佳美医疗器械专营店,swisse斯维诗乳清蛋白质粉营养男女性孕妇塑形健身中老年非分离,147,97
豹哥的补剂店,豹哥补剂 肌肉科技白金乳清蛋白粉增肌粉食品男女健身蛋白质粉5磅,238,97
大师兄运动营养,OXYENERGY氧气能量乳清蛋白质粉试用装非ISO分离乳清whey粉健身食,37,97
卡姆大叔大肌店,YAMAMOTO超能全效乳清蛋白质粉增肌健身运动补剂动物蛋白粉4.4磅,568,97
绿巨人健身健美用品,意大利YAMAMOTO超能分离乳清蛋白粉ISO-FUJI健身男女分离蛋白质粉,678,97
滔杰运动营养,拾氧女性蛋白粉左旋肉碱健身营养运动代餐女士专属乳清蛋白质粉,129,97
直销特卖超市总店,宝健出品宝健牌复合蛋白质粉固体饮料450g桶装宝健蛋白粉正品,149,97
goldensun金日旗舰店,金日牌高钙全乳清蛋白质粉礼盒装健身乳清蛋白粉中老年蛋白营养粉,328,98
mckin麦金利旗舰店,麦金利蛋白质粉增强免疫力儿童中老年女性蛋白粉营养品官方旗舰店,249,98
organika海外旗舰店,Organika奥加尼卡纯美胶原蛋白肽美颜美容水解小分子精华正品200g,208,98
澳依咔旗舰店,旭玖康分离乳清蛋白粉术后恢复营养品水解动物蛋白质营养粉老年人,458,98
百姓药堂保健食品,汤臣倍健蛋白质粉双蛋白营养粉增强中老年人免疫力正品官方旗舰店,174,98
德爱堂大药房旗舰店,汤臣倍健 蛋白粉600g礼盒 (450g+150g)蛋白质粉营养品 750g蛋白粉,55,98
铸塔保健品专营店,六星高能氮泵体考肌肉科技氮泵健身爆发力耐力跑步搭肌酸bcaa,49,98
卓兴保健品大卖场,汤臣倍健yep胶原蛋白液5G升级7袋/盒态饮口服液小分子肽粉精华,48,98
KEEP MOMENT直营店企业店,KEEP MOMENT双重乳清蛋白粉KM乳清蛋白健身补充剂战1营养粉试用装,19,99
阿里健康大药房海外店,GLGFAS术后恢复营养品速愈素化疗后免疫力调节乳清蛋白粉,282,99
安宗堂旗舰店,汤臣倍健官方旗舰店官网食品级乳清蛋白质粉老年人增强免疫力正品,79,99
百革大药房旗舰店,1kg乳清蛋白质粉中老年人增强蛋白粉营养品官方旗舰店正品免疫力,88,99
叮迷保健品专营店,同仁堂进口乳清高蛋白质粉女性增强免疫力提高老人营养旗舰店正品,88,99
湖南瑞姿生物科技有限公司,全效综合弹性胶原蛋白肽天然虾青素神经酰胺谷胱甘肽抗糖 60天量,198,99
胶原妹妹,买2送1 鲣鱼弹性蛋白肽30天量弹力蛋白水解鱼胶原蛋白粉伴侣挪威,125,99
康恩贝官方旗舰店,400g*2罐礼盒*2盒康恩贝 蛋白粉植物乳清中老年人送礼增强免疫力,366,99
天猫超市,同仁堂蛋白粉中老年人女性营养增强蛋白质粉免疫力礼品旗舰正品店,109,99
天猫国际健研馆,【自营】雀巢健康科学乳清蛋白质粉增肌粉补充营养粉227g罐分离,128,99
远子的补剂铺,ON奥普帝蒙肌酸粉300g一水肌酸蛋白粉健身增肌粉男爆发力耐力增肌,75,99
ANNA海外优选,美国安利纽崔莱蛋白质粉增强孕妇儿童中老年人免疫营养粉官方正品,175,100
AXXZIA海外旗舰店,【专属】AXXZIA晓姿AGX  30支/1盒,2500,100
BANNYDEER旗舰店,BD能量必第分离乳清蛋白粉4磅健身增肌蛋白质粉非肌酸氨基酸赛霸,259,100
Bioe营养健康海外旗舰店,bioe燕窝胶原蛋白奶粉小分子肽粉液态饮正品旗舰店澳洲原装进口,194,100
Chodown肆吃补剂,肌肉科技六星谷氨酰胺粉击退酸痛加速恢复健身运动补剂增蛋白粉,45,100
Codeage海外旗舰店,Codeage复合水解胶原蛋白肽粉小分子肽精华饮口服内服正品567g*2,729,100
EPAPLUS海外旗舰店,epaplus西班牙骨粉骨胶原蛋白进口氨糖软骨素加钙钙片维骨力关节,199,100
everbuild旗舰店,EB健型增健肌粉乳清蛋白质粉健身瘦人健肌营养粉男女欧洲原装进口,238,100
EverCollagen海外旗舰店,EverCollagen韩国进口Ever小粉罐生物素低分子胶原蛋白片润肤保湿,228,100
