品牌,商品,价格,购买人数
美凯威官方企业店,碳水化合物500克健身运动瘦人增胖增肥增重增肌粉省乳清蛋白质粉,19,100
美莱健保健食品旗舰店,美莱健蛋白质粉中老年人营养植物乳清男女性孕妇营养品补品官网,59,100
美商保健商行,中国嘉康利香草大豆蛋白粉香草蛋白粉增强体质补充蛋白质营养粉,225,100
美少女健康饮食,脱脂纯牛奶奶粉减肥专用高蛋白高钙无糖0低脂肪伊利男女正品老少,34,100
美媛春官方旗舰店,美媛春胶原蛋白液态饮正品口服液精华饮品旗舰店小分子弹性肽粉,188,100
喵喵猫915,捷克collamedic胶原蛋白粉肽剂cm冰川鳕鱼1OO%纯胶42天易吸收饱满,425,100
名人补剂,名人补剂Muscletech肌肉科技金标正氮乳清蛋白粉分离增肌粉男健身,175,100
名人补剂,名人补剂北欧海盗水解牛肉蛋白粉健身增肌粉分离乳清蛋白质粉,275,100
名人补剂,Muscletech肌肉科技零度分离乳清蛋白粉4磅男女健身增肌营养进口,155,100
名人补剂,名人补剂北欧海盗分离乳清蛋白粉健身增肌粉男运动蛋白质粉VIKING,343,100
名人补剂,名人补剂OXYENERGY氧气能量乳清蛋白粉5磅男女健身增肌粉蛋白质粉,185,100
名人补剂,名人补剂康比特分离乳清蛋白粉 炽金cpt运动蛋白质粉纯健身增肌粉,278,100
名人补剂,奥普帝蒙ON乳清蛋白粉男运动健身欧普特蒙增肌粉金标分离蛋白质粉,468,100
名人补剂,名人补剂欧普特蒙on金标分离乳清蛋白粉健身男奥普帝蒙增肌粉进口,688,100
名人补剂,Muscletec肌肉科技蛋白粉白金5磅男运动乳清蛋白质粉健身增肌粉,380,100
名人补剂,北欧海盗一水肌酸300g爆发力耐力男女蛋白粉健身增肌粉补剂非氮泵,80,100
名人补剂,名人补剂马泰时刻乳清蛋白粉健身增肌粉男女运动分离蛋白质粉WHEY,85,100
木圣闻健康食化,弹性胶原三肽五合一多效复合胶原蛋白肽全面补充真皮层角质层营养,248,100
木圣闻健康食化,日本NIPPI鱼胶原蛋白肽胶原三肽深海红鲷鱼小分子易吸收拍二送一,93,100
木易木华保健品专营店,燕窝胶原蛋白质营养粉官方旗舰店正品增强搭女性免疫力补品送父母,78,100
奈力士健康食品店,新西兰原装进口奈氏力斯高蛋白质粉中老年免疫力术后营养恢复补品,205,100
奈力士食品旗舰店,【预售】新西兰进口乳清蛋白质粉高蛋白瘦人中老年补品免疫力营养,100,100
南北同堂连锁店,南京同仁堂中老年儿童男女性营养强化蛋白质粉乳清蛋白奶粉免疫力,128,100
南京同仁堂生物科技福记坊1号店,蛋白粉中老年营养粉儿童高钙益生菌蛋白质粉免疫力官方旗舰店正品,88,100
南京同仁堂自营网店,北京同仁堂胶原蛋白肽口服液燕窝海参粉正品女性白官网官方旗舰店,29,100
南纬11度全球购,澳洲Nature's Way佳思敏植物蛋白质蛋白粉健身女性成人中老年免疫,77,100
南纬11度全球购,斯维诗Swisse胶原蛋白肽粉血橙保健女士美养品容颜玻尿酸胶原蛋白,65,100
妞妞澳洲生活馆,斯维诗Swisse乳清蛋白粉健身增肌粉中老年增强体质免疫力蛋白质粉,157,100
妞妞澳洲生活馆,澳洲Nature's Way佳思敏植物大豆蛋白质粉速溶营养健身增肌蛋白粉,67,100
牛哥的补剂铺,诺特兰德双重乳清蛋白粉运动健身分离蛋白增肌粉5磅乳清蛋白质粉,53,100
纽迪希亚特医营养品旗舰店,新版纽太特深度水解乳清蛋白配方粉 食物蛋白过敏婴幼儿适用450g,338,100
纽斯葆旗舰店,纽斯葆蛋白质粉乳清动植物双蛋白中老年人增强免疫力营养成人男女,159,100
暖蔻旗舰店,暖蔻寇蛋白粉增强成人学生免疫球抵抗力营养乳清蛋白质粉正品旗舰,188,100
诺特兰德顶程专卖店,诺特兰德蛋白粉营养粉成人大豆植物蛋白质粉中老年官方旗舰店正品,29,100
诺特兰德鸿飞专卖店,诺特兰德支链氨基酸bcaa粉剂健身运动补剂蛋白增肌bacc氨肌酸氮泵,39,100
诺特兰德旗舰,诺特兰德支链氨基酸bcaa健身非乳清蛋白增肌粉官方旗舰店氮泵肌酸,29,100
诺特兰德旗舰,诺特兰德女士轻盈乳清蛋白粉蛋白质营养粉健身官方旗舰店正品,199,100
诺特兰德旗舰,诺特兰德增肌粉乳清蛋白质粉瘦人健身增肌营养重健肌粉男官方正品,169,100
诺特兰德旗舰,诺特兰德乳清蛋白粉蛋白质粉10磅健身增肌粉运动浓缩乳清营养粉,229,100
诺祯旗舰店,蛋白粉中老年成人男女性蛋白质营养粉官方旗舰店正品增强免疫力粉,59,100
品牌体验官,英贝健蛋白质粉官方旗舰店益生菌牛初乳蛋白粉1000g成人中老年人,69,100
七情谷保健品专营店,钙铁锌蛋白质粉中老年人增强搭免疫力补钙骨质疏松奶粉官方旗舰店,113,100
七香膳食海外购,美国安利纽崔莱蛋白质粉无糖型增强儿童孕妇体质中老年免疫营养粉,179,100
权baobaoの代购小铺,新款日本购明治胶原蛋白粉金装袋子透明196g替换装28日装包邮,169,100
雀草方滋补养生品牌店,典唯蛋白粉分离乳清增肌粉健身男女蛋白粉瘦人增肌增重蛋白质粉,156,100
雀巢健康科学海外旗舰店,雀巢蛋白补乳清蛋白质粉无糖增肌健身蛋白营养粉官方旗舰店1罐,128,100
雀巢健康科学特医食品旗舰店,雀巢肽敏舒特殊医学用途婴儿乳蛋白深度水解配方粉400g*4罐含乳糖,1472,100
雀巢健康科学特医食品旗舰店,雀巢佳膳悠选特殊医学用途全营养配方食品400g*6罐老人营养粉优选,1100,100
仁和保健食品旗舰店,仁和阿胶燕窝胶原蛋白片肽粉小分子精华液态口服饮品正品旗舰店,59,100
仁和滋补养生旗舰店,仁和燕窝胶原蛋白肽粉液态饮正品口服鱼小分子饮品官方旗舰店正品,49,100
瑞兰康保健品专营店,汤臣倍健蛋白粉蛋白质营养粉增强免疫力官方中老年人旗舰正品,58,100
瑞士天空,瑞士 swiss alp SAH女性水解胶原蛋白肽粉超声紧致嫩白抑氧化缓衰,998,100
润德大药房旗舰店,胶原蛋白肽液态饮燕窝VC官方旗舰店正品口服液女小分子肽粉饮品VD,118,100
赛霸旗舰店,赛霸高纯一水肌酸粉 健身增健肌补剂力量爆发力非bcaa氮泵蛋白粉,89,100
赛霸旗舰店,赛霸分离乳清蛋白粉2磅增健肌健身低脂高蛋白质粉官方旗舰店正品,199,100
赛霸旗舰店,赛霸乳清蛋白粉10磅袋装健身增健肌运动营养蛋白质粉官方旗舰店,419,100
森山官方旗舰店,铁山岗蛋白质粉固体饮料10g*50包铁盒装动植物复配蛋白粉补充营养,199,100
莎莎澳洲优选,澳洲Swisse蛋白粉纯乳清蛋白增肌粉成人蛋白中老年蛋白质粉斯维诗,146,100
善存官方旗舰店,善存老年人蛋白粉乳清蛋白质粉植物蛋白粉10g*24袋官方旗舰店正品,110,100
善存官方旗舰店,善存中老年人蛋白增强免疫力粉乳清蛋白质植物蛋白粉女性营养15袋,110,100
善力倍旗舰店,善力倍白蛋白 白蛋白肽 中老年术后营养补充口服液非人血白白蛋白,278,100
膳力达诺达正品店,膳力达德国进口动物短肽水解乳清蛋白质粉补品营养品粉送父母长辈,470,100
膳力达旗舰店,膳力达德国进口水解动物乳清蛋白粉短肽术后恢复中老年营养粉2盒,676,100
上健协严选店,马泰时刻乳清进口分离乳清蛋白粉高蛋白运动健身增肌粉临期乳清,78,100
上善保健食品专营店,B美盾 益生菌驼乳营养粉320g蛋白营养粉益生菌驼乳营养粉官方正品,299,100
尚动食品专营店,直播间专属福利  新粉尝新  汤臣倍健动植物双蛋白质粉150g,150,100
尚赫网络运营商,尚赫蛋白质粉尚赫牌蛋白质粉40袋正品4.5元一袋,168,100
尚睿海外专营店,新西兰Keyora进口深海鱼胶原蛋白美颜胶囊肽粉口服小分子弹性蛋白,149,100
深谷溪田旗舰店,深谷溪田益生菌驼奶蛋白粉学生中老年成人儿童早餐营养蛋白质粉,64,100
深谷溪田旗舰店,深谷溪田益生菌驼奶粉蛋白质粉儿童学生成人中老年男女营养粉,64,100
深谷溪田旗舰店,深谷溪田益生菌羊乳蛋白粉学生成人儿童中老年男女营养蛋白质粉,79,100
深谷溪田旗舰店,深谷溪田益生菌羊乳蛋白粉早餐儿童学生中老年营养蛋白质粉,79,100
深谷溪田旗舰店,深谷溪田益生菌驼奶蛋白粉学生中老年成人儿童早餐营养蛋白质粉,64,100
深谷溪田旗舰店,深谷溪田益生菌驼奶粉蛋白质粉儿童学生成人中老年男女营养早餐,64,100
深谷溪田旗舰店,深谷溪田益生菌驼奶粉蛋白质粉儿童学生成人中老年男女营养粉,64,100
深谷溪田旗舰店,深谷溪田益生菌驼奶蛋白粉学生中老年儿童成人早餐营养蛋白粉,64,100
深谷溪田旗舰店,深谷溪田益生菌羊乳蛋白粉儿童学生成人中老年营养蛋白质粉,79,100
圣卡斯国际海外旗舰店,澳洲蛋白质粉植物免疫球蛋白粉大豆蛋白营养粉中老年人增强免疫力,90,100
圣乐元保健食品店,汤臣倍健蛋白粉营养蛋白质粉免疫力老年人男女性官方旗舰店正品,44,100
施元旗舰店,施元免益多维蛋白质粉儿童成人中老年乳清植物混合双蛋白滋补营养,158,100
施元正品店,南京同仁堂中老年无加蔗糖氨基酸益生菌牛初乳阿胶铁锌钙蛋白质粉,35,100
食麦郎旗舰店,益生菌蛋白营养粉中老年增强搭免疫力猴头菇养胃粉官方旗舰店正品,93,100
食麦郎旗舰店,燕窝胶原蛋白营养粉官方旗舰店正品搭增强女性免疫力血压低提高补,73,100
汤臣倍健佰健专卖店,汤臣倍健健乐多纤能蛋白粉乳清蛋白质粉健身运动营养代餐奶昔女性,68,100
汤臣倍健佰健专卖店,汤臣倍健健乐多蛋白增肌粉纯乳清蛋白质粉瘦人增肌健身男女增重,178,100
汤臣倍健佰健专卖店,汤臣倍健胶原蛋白肽液态饮正品官网旗舰店yep磁感小粉瓶口服液,245,100
汤臣倍健佰健专卖店,汤臣倍健yep磁感小粉瓶胶原蛋白肽液态饮口服小分子正品官方旗舰,225,100
汤臣倍健官方旗舰店,汤臣倍健蛋白健身增肌粉纯乳清蛋白质粉男女性减脂官方旗舰店正品,287,100
汤臣倍健官方旗舰店,蛋白质粉增强免疫力成人男女官方旗舰店,421,100
汤臣倍健官方旗舰店,汤臣倍健蛋白质粉高蛋白营养粉大豆粉水果味美味营养品官方旗舰店,297,100
汤臣倍健食品旗舰店,汤臣倍健蛋白粉质乳清蛋营养粉成人免疫球蛋白增强免疫力旗舰正品,148,100
汤臣倍健众华朗臣专卖店,汤臣倍健乳清蛋白蛋白质粉老年人免疫力纯营养女性官方正品旗舰店,179,100
汤臣倍健众华朗臣专卖店,【双11狂欢购】实付599+0.1送/多选1不叠加/单拍不发联系客服改价,0,100
汤臣倍健众华朗臣专卖店,汤臣倍健儿童蛋白质粉学生补充蛋白营养粉青少年官方正品旗舰店,276,100
汤臣营养健康,汤臣倍健蛋白质粉乳清营养粉中老年男女增强官方免疫力正品旗舰店,218,100
汤臣营养品企业店,汤臣倍健乳清蛋白质粉增重高蛋白营养粉官方老年人男女正品旗舰店,148,100
汤臣营养品企业店,汤臣倍健蛋白质粉乳清营养粉官方增强中老年男女免疫力旗舰店正品,359,100
唐氏盛泰保健食品专营店,多合蛋白质粉复合氨基酸中老年人女性补充营养乳清粉滋补免益力,128,100
提莫队长营养俱乐部,康宝莱奶昔国产俱乐部官网正品康宝莱代餐蛋白粉支持验货全国包邮,170,100
体育生正品补剂店,康比特三健特青少年系列双乳蛋白粉800g体育生中高考体能训练补剂,149,100
天猫超市,北京同仁堂多维高钙乳清蛋白质粉营养儿童中老年人增强蛋白免疫力,48,100
天猫超市,肌肉科技六星益生菌增肌粉瘦人增重增肌蛋白粉乳清蛋白质粉健身男,258,100
天猫超市,江中初元人参蛋白粉营养品营养粉420g/盒老年人术后补品送礼礼盒,108,100
天猫超市,江中初元卓悦蛋白粉增强免疫力营养品中老年人400g*2罐送礼礼盒装,258,100
天猫超市,汤臣倍健蛋白质粉正品营养蛋白粉植物补品中老年人女性旗舰官方品,159,100
天猫超市,江中初元卓悦蛋白粉老年人蛋白增强免疫力粉乳清蛋白营养品400g罐,149,100
天猫超市,汤臣倍健健乐多乳清蛋白增肌粉瘦人男增重增肌健肌粉450g+摇摇杯,68,100
天猫超市,九芝堂蛋白粉中老年人女性营养蛋白质粉增强免疫力官方旗舰正品店,289,100
天猫超市,汤臣倍健蛋白质粉营养中老年人女提高增强免疫力搭植物蛋白粉550g,389,100
天猫超市,fiboo奶昔粉蛋白代餐饱腹食品早晚餐营养主食速食400g*4袋,449,100
天猫超市,麦金利乳清蛋白粉老年人增强免疫力蛋白质粉营养粉女性青少年学生,198,100
天猫超市,汤臣倍健蛋白质粉增强免疫力中老年免疫球蛋白成人男女营养品600g,367,100
天猫超市,北京同仁堂胶原蛋白肽液态饮口服液小分子燕窝肽粉官方旗舰正品店,109,100
天猫超市,北京同仁堂胶原蛋白肽粉液态饮正品口服液鱼小分子饮品官方店旗舰,159,100
天猫超市,九芝堂人参海参蛋白粉500gX2桶增强提高免疫力男女中老年人乳清,188,100
天猫国际探物日本,日本直邮Pola宝丽胶原蛋白粉紧致弹性润泽肌肤嫩肤90包,555,100
天猫国际自营全球超级店,【自营】肌肉科技白金纯乳清蛋白质增肌粉健身男正品分离水解whey,261,100
天猫国际自营全球超级店,【自营】ALLMAX天然分离乳清蛋白粉纯乳清蛋白质粉增肌粉瘦人运动,358,100
天猫国际自营全球超级店,【自营】GLGFAS骨折骨裂恢复药营养品术后补钙骨伤骨骼愈合蛋白粉,268,100
天猫国际自营全球超级店,【自营】雀巢VitalProteins牛胶原蛋白肽粉大蓝罐水解小分子进口,259,100
天猫国际自营全球超级店,【自营】Swisse斯维诗胶原蛋白肽水光粉口服玻尿酸28包含维生素C,159,100
天猫国际自营全球超级店,【自营】肌肉科技六星益生菌蛋白增肌粉纯乳清蛋白质瘦人增肌增重,158,100
天美健官方旗舰店,天美健胶原蛋白肽饮多肽高浓度小分子口服液保健品官方旗舰店正品,269,100
天然养生保健食品,正品 养生堂蛋白粉400g男女健身浓缩乳清蛋白80%植物大豆蛋白,105,100
天欣保健食品专营店,DG益生菌驼奶中老年蛋白质粉骆驼乳营养粉儿童蛋白粉驼奶粉正品,299,100
甜心与麻麻,大容量胶原蛋白肽粉进口深海鳕鱼皮低聚肽非饮品口服液甜心与麻麻,146,100
同仁堂北京专卖,北京同仁堂蛋白质粉进口乳清蛋白粉300g滋补品旗舰店官方正品,269,100
土豆麻麻国产俱乐部,康宝莱奶昔官网正品官网国产蛋白粉奶昔代餐粉康宝莱蛋白营养粉,235,100
万豪佶保健品专营店,氨基酸蛋白质粉补营养品中老年人增强搭免疫力粉官方旗舰店正品,75,100
万疆保健食品,600克礼盒 汤臣倍健乳清蛋白粉营养蛋白质粉强免疫力中老年男女吃,213,100
万疆保健食品,发20瓶】汤臣倍健胶原蛋白口服 液液态饮正品 蛋白液肽非丸水解粉,94,100
万松堂保健品专营店,汤臣倍健蛋白质粉正品乳清营养粉男女中老年增强免疫力官方旗舰店,122,100
威高旗舰店,威高分离乳清蛋白质粉新西兰低磷钾肾透析血液术后营养高蛋白独立,156,100
维尔康医药连锁,唯卡能特殊医学用途全营养配方粉食品拜仑斯特浓缩乳清蛋白非修正,280,100
伟仔妈肽之恋,三型弹性蛋白复合肽口服玻尿酸补水保湿伟仔妈胶原弹力蛋白肽包邮,146,100
为粉丝开的店FOR FANS THE STORE,肌肉科技六星分离乳清蛋白粉增肌粉乳清蛋白质粉运动健身营养粉,200,100
为粉丝开的店FOR FANS THE STORE,MUSCLETECH肌肉科技正氮乳清蛋白粉8磅粉营养粉男女健身,215,100
为粉丝开的店FOR FANS THE STORE,AS澳都赛斯乳清蛋白粉5磅whey优追麦克斯健身奥都塞斯分离乳清,218,100
为粉丝开的店FOR FANS THE STORE,Muscletech肌肉科技白金乳清蛋白粉健身增肌粉分离蛋白质5磅进口,185,100
为粉丝开的店FOR FANS THE STORE,北欧海盗帝国乳清蛋白质粉5磅VIKING健身增肌男女瘦人健肌粉营养,283,100
为粉丝开的店FOR FANS THE STORE,肌肉科技六星益生菌乳清蛋白粉8磅增肌蛋白质运动健身瘦人增肌,285,100
沃勒尔全球健康体验馆,Swisse斯维诗胶原蛋白小Q粉28包7包亢糖血橙精华小分子胶原蛋白肽,32,100
沃勒尔全球健康体验馆,【热巴同款】Swisse斯维诗乳清蛋白粉香草味蛋白粉补充氨基酸营养,189,100
无麸质酱油品牌店,启伴豌豆蛋白粉无麸质无糖0添加0脂桥本孕妇哺乳期植物蛋白粉350g,149,100
吴江千林保健品专营店,180袋可选麦金利牌蛋白粉儿童孕妇中老年男女大豆乳清双蛋白质粉,68,100
吴越老百姓大药房旗舰店,汤臣倍健蛋白质粉乳清官方旗舰店正品 中老年增强免疫力营养粉 XD,59,100
纤纤营养屋,康宝莱奶昔海盐布朗尼奇亚籽奶茶口味官网旗艦店正品国产蛋白粉,240,100
纤妍保健食品专营店,氨基酸蛋白质粉增强补营养中老年人非免疫力送父母官方旗舰店正品,71,100
祥顺堂健康食品,800g汤臣倍健乳清蛋白质粉香草健身蛋白营养粉老年人女性官方正品,208,100
小雏菊国产俱乐部,安利纽崔莱蛋白营养粉儿童草莓味水果味青少年免疫力植物蛋白质粉,276,100
小杰运动营养,赛霸乳清蛋白粉健身增肌分离水解乳清蛋白质补剂塞霸whey健身男女,129,100
小姐姐全球优选,Swisse胶原蛋白肽粉小分子血橙精华饮品口服玻尿酸水光粉28包,65,100
小林户外丨正品折扣店,进口明治SAVAS匝巴斯乳清蛋白粉运动健身肌营养粉可可香草酸奶味,199,100
小隆人正品补剂商城,正品康比特炽金酸奶乳清蛋白粉4磅益生菌运动健身增肌粉旗舰官网,379,100
小隆人正品补剂商城,肌肉科技白金乳清蛋白粉5磅纯乳清蛋白蛋白质粉健身男女增健肌粉,185,100
小隆人正品补剂商城,【官方正品】肌肉科技纯乳清蛋白粉5磅白金分离健身男女增健肌粉,185,100
小牛之家,汤臣倍健蛋白粉营养粉蛋白质粉儿童中老年男女性免疫力 450g/罐,140,100
小圆全球优选,Swisse乳清蛋白粉成人健身增肌增重中老年孕妇斯维诗混合蛋白质粉,139,100
欣宝母婴奶粉食品店,新版24年4月德国雀巢速愈素香港版74g*10包蛋白营养粉放化疗营养,279,100
幸运树保健食品专营店,鹭青全分离乳清蛋白粉动物蛋白质术后恢复营养品成人中老年人原味,259,100
旭玖康保健品旗舰店,旭玖康 配料99%动物蛋白质水解分离乳清蛋白粉老年人术后营养品,473,100
旭康保健食品专营店,阿胶蛋白质粉女性增强营养搭免疫力官方旗舰店正品红枣补品送父母,127,100
轩德医疗,力存乳清蛋白粉320g企业店铺正品保证院线同款品术后恢复固体饮料,258,100
炫动保健食品专营店,汤臣倍健双蛋白质营养粉中老年人增强免疫力官方旗舰店正品男女性,228,100
雪岩保健品专营店,益生菌蛋白质搭增肌粉增肥增胖男性女性产品瘦人增重快速长肉变胖,89,100
雪岩保健品专营店,阿胶女性蛋白质营养粉血压低增强搭红枣补品官方旗舰店正品免疫力,167,100
训练怪兽官方店,UP训练怪兽黑钻乳清蛋白粉健身增健肌粉高蛋白营养粉向上星球,269,100
雅琪食品配料,新西兰浓缩wpc80乳清蛋白粉wpl90分离乳清蛋白粉健身运动粉原粉,13,100
阳洋家芳香密语,十重弹性胶原蛋白肽玻尿酸虾青素多效营养真皮糖氧老化水光弹滑嫩,134,100
养生滋补保健食品店,同仁堂中老年长辈益生菌高钙驼乳蛋白营养粉驼奶粉正品官方旗舰店,68,100
氧气能量Muscle能量运动营养店,诺特兰德谷氨酰胺粉运动健身补剂非蛋白粉bcaa支链氨基酸肌酸氮泵,12,100
氧气能量旗舰店,氧气能量分离乳清蛋白粉乳糖不耐受官方旗舰便携装分离乳清蛋白粉,279,100
药都仁和康枚婷专卖店,俄罗斯进口驼奶蛋白营养粉老年人女性增强搭免疫力官方旗舰店正品,99,100
野牛家,安利纽崔莱蛋白营养粉核桃肽草莓味多种钙质免疫力植物蛋白质粉,294,100
野牛家,康宝莱袋奶昔蛋白营养粉官网旗舰店正品代餐粉红豆薏苡仁曲奇芒果,761,100
野兽的补剂商城,紫光优健POWERBUFF炽炼乳清蛋白粉WHEY蛋白粉5磅三重分离浓缩水解,299,100
野兽的补剂商城,ON欧普特蒙乳清蛋白粉5磅健身补剂金标奥普帝蒙增肌蛋白质粉WHEY,230,100
野兔先生正品运动营养,Muscletech肌肉科技白金增肌粉乳清蛋白质粉健身瘦人增肌增重桶装,188,100
野兔先生正品运动营养,muscletech肌肉科技高性能增肌粉瘦人增重蛋白粉健身增肌乳清蛋白,178,100
以琳养生铺子,美莱健益生元蛋白质粉大豆乳清双蛋白粉老年人免疫力调理肠胃,88,100
亦康保健食品,共1200克汤臣倍健蛋白粉高蛋白质营养粉成人中老年人植物营养粉,188,100
亦康保健食品,10瓶汤臣倍健6000mg胶原蛋白肽树莓味小磁感液态饮高光小粉瓶正品,114,100
异彩运动营养店,UP训练怪兽黑钻乳清蛋白粉高蛋白营养粉训练增健肌粉向上星球whey,199,100
意美品营养商行,每品康乳清蛋白粉,198,100
优美甄选食品店,汤臣倍健蛋白质粉乳清蛋白粉官方旗舰正品增强中老年人免疫力营养,159,100
悠悠养生滋补店,Swisse斯维诗蛋白粉中老年人营养运动健身营养粉乳清蛋白粉450g,144,100
有氧星球旗舰店,汤臣倍健蛋白粉蛋白质粉增强免疫力中老年人女官方旗舰店,321,100
御济堂大药房旗舰店,汤臣倍健蛋白质粉乳清官方正品动植物中老年增强免疫力双蛋白粉CS,58,100
远子的补剂铺,康比特CPT炽金乳清蛋白粉酸奶味健身肌性成人运动营养5磅超熊猫ON,388,100
远子的补剂铺,康比特分离乳清蛋白质粉抹茶味1800g 健身增肌粉whey运动成人,278,100
远子的补剂铺,意大利YAMAMOTO超分离乳清蛋白粉ISO-FUJI分离零糖零脂2KG 4.4磅,678,100
远子的补剂铺,ALLMAX金牌金标经典乳清蛋白质粉5磅 健身塑型瘦人增重健肌非分离,278,100
远子的补剂铺,远子的补剂铺VIKING北欧海盗水解牛肉分离蛋白粉4.4磅 增肌增重,255,100
远子的补剂铺,赛霸肌酸粉300g一水肌酸粉男女健身增健肌蛋白粉爆发力耐力非氮泵,39,100
远子的补剂铺,远子的补剂铺 MUTANT WHEY魔兽四核乳清蛋白质粉5磅瘦人增重,275,100
远子的补剂铺,马泰时刻乳清蛋白粉whey高蛋白健身运动男女营养增肌健肌增重5磅,85,100
远子的补剂铺,远子的补剂铺MUTANT魔兽ISO炫味分离乳清蛋白粉5磅健身 非isoflex,418,100
远子的补剂铺,肌肉科技增肌粉7磅 健身男女瘦人增重乳清蛋白质粉含肌酸美国营养,219,100
远子的补剂铺,On奥普帝蒙欧普特蒙金装金标ISO分离乳清蛋白质粉5磅WHEY增肌塑型,223,100
远子的补剂铺,盖特概特GAT分离乳清蛋白粉5磅混合肌肉蛋白奶昔运动健身增肌非ON,239,100
远子的补剂铺,Dymatize 狄马泰斯ISO100迪马泰斯水解分离乳清蛋白粉低脂低糖5磅,293,100
远子的补剂铺,谷本日记代餐奶昔粉饱腹高蛋白早晚餐速食冲饮膳食纤维营养轻食品,18,100
月亮宝宝饮品食品保健,氨基酸高钙蛋白质粉增加中老年人免疫力高钙无糖蛋白全营养粉三高,86,100
悦活360健康生活馆,江中初元卓悦蛋白粉增加免疫力0蔗糖乳清大豆双蛋白中老年成人喝,60,100
悦佳保健品食品店,汤臣倍健蛋白粉150g大豆蛋白乳清双蛋白成人中老年人营养免疫力,43,100
云购(商城),安利蛋白粉纽崔莱多种植物营养粉蛋白质粉孕妇青少年中老年免疫力,515,100
运动补剂装备小店,赛霸2磅乳清蛋白粉健身增肌分离蛋白质粉补剂whey增肥增重健肌粉,125,100
真诚滋补养生专营店,更划算！汤臣倍健蛋白质粉植物型乳清无糖蛋白粉男女中老年成人,118,100
郑州金诺生物科技,鱼胶原蛋白肽粉 水解抗糖化小分子肽 深海鳕鱼皮提取多肽纯粉,41,100
直销保健品企业店,正品amway纽崔莱官方旗舰店官网蛋白营养粉孕妇 青少中老年蛋白质,515,100
直销企业直供店,安利纽崔莱多种植物蛋白质粉中老年营养粉青少年孕妇免疫力400克,280,100
智贝利旗舰店,智贝利人参燕窝胶原蛋白肽粉蔓越莓口服粉剂液饮品旗舰店冲饮30袋,159,100
中航生物科技企业店,希尔玛WPI90分离乳清蛋白粉健身补剂增肌粉高蛋白质新西兰wpc80%,48,100
中粮保健品旗舰店,6桶装】中粮可益康蛋白质粉成人营养粉男女性乳清植物蛋白粉,588,100
中粮食品旗舰店,拍2发5桶】中粮蛋白质粉乳清成人营养品高钙蛋白粉,188,100
卓叔瘦人增重店,卓叔增重【白金乳清蛋白粉】肌肉科技Muscletech健身增肌WHEY男女,248,100
卓叔瘦人增重店,卓叔增重 7磅【益生菌增肌粉】肌肉科技六星瘦人蛋白健身养护肠胃,343,100
姿美养生堂,姿美堂胶原肽蛋白资美堂小分子肽粉液态饮旗舰店官方正品提拉紧致,17,100
