品牌,商品,价格,购买人数
Allmax保健品海外旗舰店,ALLMAX纯分离乳清蛋白质粉蛋白粉增肌粉健身瘦人运动无糖营养粉,648,200
AXXZIA海外旗舰店,【于文文推荐】AXXZIA晓姿抗糖饮AGX胶原蛋白饮口服提亮30支*1盒,1490,200
careplus海外旗舰店,蛋白粉蛋白质增强中老年人免疫力老人无糖营养动物官方旗舰店正品,144,200
Chodown肆吃补剂,Muscletech肌肉科技增肌粉瘦人增重增肌高性能乳清蛋白质健身mass,135,200
Codeage海外旗舰店,Codeage复合水解胶原蛋白肽粉小分子内服精华饮内调旗舰店,284,200
gnc健安喜旗舰店,GNC健安喜乳清蛋白粉成年健身增肌营养粉蛋白质营养品冲调速食,179,200
gnc健安喜旗舰店,GNC蛋白粉增强免疫力中老年人女性蛋白质营养品官方旗舰店,179,200
goodnature海外旗舰店,【2瓶装】swisse葡萄籽烟酰胺全身美白丸胶原蛋白肽粉抗美颜衰老,162,200
goodnature海外旗舰店,swisse葡萄籽美白丸全身内服口服烟酰胺美白饮内调胶原蛋白抗糖丸,61,200
Gynable海外旗舰店,洁妮贝盆底宝 产后女性盆底肌养护修复 保养骨盘恢复凯格尔30包,288,200
lomon海外专营店,美国安利纽崔莱植物蛋白质粉900g大罐中老年成人蛋白粉 马来销售,368,200
Lumi旗舰店,Lumi胶原蛋白粉液态饮正品小分子肽粉精华饮品口服液官方旗舰30袋,99,200
meiji明治食品旗舰店,meiji明治 SAVAS匝巴斯进口大豆蛋白运动营养粉21g*2袋试用体验装,9,200
morinaga森永海外旗舰店,森永乳清蛋白蛋白质粉进口中老年补品术后恢复营养品免疫球蛋白粉,239,200
Muscle Kangaroo,诺特兰德支链氨基酸bcaa健身非乳清蛋白粉氮泵支链肌酸,17,200
Muscle Kangaroo,诺特兰德充能糖电解质饮料电解质粉冲剂梯度碳水体育生非蛋白粉,8,200
muscletech官方旗舰店,Muscletech肌肉科技白金增肌粉乳清蛋白质粉健身瘦人增肌增重健肌,198,200
MyNature海外旗舰店,Mynature迈美希Melatine?小黑盒专利水解角蛋白头发管理男女通用,540,200
Myprotein海外旗舰店,Myprotein大豆分离蛋白粉代餐奶昔植物蛋白质营养粉素食 vgn,185,200
ON奥普帝蒙旗舰店,ON奥普帝蒙 绿标超霸增肌粉乳清蛋白粉6磅 瘦人增重 蛋白质增肌粉,288,200
ON奥普帝蒙旗舰店,金标乳清蛋白粉10磅 ON奥普帝蒙 健身WHEY蛋白质粉10磅,996,200
ON奥普帝蒙旗舰店,ON奥普帝蒙 绿标增肌粉乳清蛋白粉3磅 瘦人增肌蛋白质,119,200
organika海外旗舰店,Organika加拿大进口增强型胶原蛋白肽美颜小分子草饲牛胶精华250g,188,200
PEAKOCEAN海外专营店,ON奥普帝蒙 金标乳清蛋白粉 WHEY健身营养增肌蛋白粉美国进口 5磅,478,200
POWERBUFF旗舰店,紫光优健POWERBUFF炽炼乳清蛋白粉WHEY蛋白粉5磅三重分离浓缩水解,29,200
prosupps旗舰店,海德力蛋白粉乳清蛋白质粉运动健身塑性营养粉增肌粉官方whey,189,200
prosupps旗舰店,海德力乳清蛋白粉增肌粉蛋白质粉草莓运动健身营养粉whey,149,200
prosupps旗舰店,海德力益生菌增肌粉复合乳清蛋白质粉健身补剂瘦人推荐健肌粉whey,169,200
swisse官方旗舰店,Swisse斯维诗乳清蛋白质粉中老年免疫力成人蛋白营养粉,259,200
swisse聚优库专卖店,Swisse斯维诗蛋白粉乳清营养蛋白质粉香草味官方旗舰店蛋白质正品,209,200
umeken海外旗舰店,Umeken日本进口弹力蛋白胶原蛋白肽粉精华小分子3盒减90 5盒减300,820,200
Vinsic海外旗舰店,Vinsic文斯可牛初乳铁乳清蛋白质粉中老年成人增强体质免yi球蛋白,458,200
阿里健康大药房,黄金搭档蛋白质粉中老年人蛋白粉补充蛋白质补品营养品送父母正品,79,200
阿里健康大药房,仁和蛋白营养粉女性官方旗舰店减正品肥咖啡增强蛋白质粉补免疫力,39,200
阿里健康大药房,仁和阿胶燕窝胶原蛋白片肽粉小分子精华液态口服官方旗舰店正品,19,200
阿里健康大药房,北京同仁堂人参蛋白粉营养蛋白质粉中老年成人男女增强免疫力正品,58,200
阿里健康大药房,增肥增胖长胖男性女性益生菌增重蛋白质粉瘦人快速长肉高脂肪食品,79,200
阿里健康大药房,九芝堂胶原蛋白肽粉饮品液态燕窝饮小分子肽口服液正品官方旗舰店,78,200
阿里健康大药房,【42%蛋白】白云山益生菌增肌粉瘦人增肌增重乳清蛋白质粉健身男,79,200
阿里健康大药房,北京同仁堂胶原蛋白肽液态饮口服液燕窝粉鱼小分子官方旗舰店正品,99,200
阿里健康大药房,北京同仁堂燕窝烟酰胺胶原蛋白肽粉液态饮七夕礼物正品官方旗舰店,89,200
爱昔俱乐部,康宝莱奶昔官网旗舰店正品国产康宝莱代餐奶昔正品官网蛋白营养粉,230,200
安琪纽特旗舰店,安琪纽特纽邦酵母蛋白粉成人蛋白质粉植物蛋白乳清蛋白,65,200
澳海海外专营店,美国产康宝莱奶昔代餐奶昔粉饱腹食品蛋白质营养粉套餐原装进口,219,200
澳海海外专营店,美国安利纽崔莱蛋白质粉免疫纽崔莱植物蛋白营养粉900g安利进口,219,200
澳佳美医疗器械专营店,Swisse蛋白质粉免疫力补钙骨质疏松女性中老年人非增强燕麦营养品,109,200
百济新特大药房旗舰店,雅培全安素进口蛋白质全营养配方粉奶粉900g新加坡官方旗舰店,238,200
柏佳康大药房旗舰店,胶原蛋白营养粉官方旗舰店正品老年人搭增强女性免疫力质提高,68,200
豹哥的补剂店,豹哥补剂 ON奥普帝蒙蛋白粉 WHEY增肌健身运动纯乳清蛋白质粉10磅,878,200
北美鼠,国产康宝莱奶昔蛋白营养粉官网旗舰店正品 饱腹代餐粉红豆薏苡仁,230,200
北同工厂总店,北京同仁堂金奥力牌蛋白质粉老年人增强营养免疫力官方旗舰店正品,29,200
彩箭保健食品专营店,蛋白质益生菌中老年人高钙无糖精骆驼奶粉糖尿饼病人营养食品补品,198,200
茶哥要什么有什么,茶哥一生推匈牙利vitaltrend高纯度弹力蛋白胶原蛋白肽粉正品500g,409,200
肠内营养,邦世迪乳清蛋白质粉德国进口原料无蔗糖营养食品纯动物蛋白粉300g,158,200
超神运动营养补剂站,康比特润力饮电解质水粉功能性运动饮料青少年体育生体考体训添VC,159,200
宠洛洛医药旗舰店,PJ香港养生堂益生菌高钙驼奶粉中老年儿童成人早餐营养驼奶粉,169,200
宠洛洛医药旗舰店,YG香港养生堂益生菌高钙驼奶粉中老年儿童成人早餐营养驼奶粉,169,200
初元保健品旗舰店,江中初元胶原蛋白肽液态饮口服液旗舰店正品玻尿酸小分子虾青素粉,129,200
春禄富泰保健食品专营店,Maxigenes美可卓蓝胖子全脂高钙学生儿童成人增强奶粉记忆免疫力,98,200
大参林大药房旗舰店,雅培全安素营养粉900g香草味蛋白配方成人奶粉营养粉原装进口,228,200
大牌营养食品店,汤臣倍健蛋白质粉官方旗舰店官网正品增强中老年免疫力乳清营养粉,159,200
大师兄运动营养,Myprotein熊猫摇杯500ml健身运动蛋白增肌粉搅拌球带刻度杯,13,200
大熠保健食品专营店,【共发180粒】优尔胶囊修正牌口服免疫球蛋白儿童成人调节免疫力,268,200
叮迷保健品专营店,DHA蛋白质粉儿童学生青少年增强搭记忆力补脑免疫力奶粉官方正品,85,200
朵颜朵姿保健品旗舰店,8盒胶原蛋白液态饮正品烟酰胺小分子精华肽粉口服玻尿酸提亮官网,149,200
范奈司运动营养中心,Muscletech肌肉科技乳清蛋白粉白金5磅健身蛋白增肌粉分离蛋白粉,185,200
福哆哆5,23年3月产雀巢佳膳悠选全营养粉400g瑞士原装进口奶粉成人蛋白粉,133,200
港品自营店,进口胶原蛋白美颜胶囊口服肽粉鱼液态饮抗亢衰老片官方旗舰店正品,229,200
怪兽168 运动营养,澳洲maxines蛋白粉女性分离乳清蛋白质营养粉女士健身代餐饱腹,209,200
国肽保健食品专营店,国肽胶原蛋白肽牛骨小分子活性肽粉术后恢复营养品高蛋白粉复合肽,338,200
国肽保健食品专营店,郎平代言 人民国肽小分子活性肽粉 牛骨胶原蛋白肽复合多肽健尔肽,199,200
海南华研厂家直售,海南华研原材料小分子鳕鱼胶原蛋白肽口服液补充面部原料,109,200
海南华研厂家直售,海南华研胶原三肽小分子鱼胶原蛋白肽纯粉水解原料正品,384,200
海王星辰大药房旗舰店,汤臣倍健蛋白粉礼盒装动植物双蛋白增强免疫力600g（450g+150g）,206,200
海王星辰大药房旗舰店,斯维诗SWISSE 乳清蛋白粉 香草味 澳大利亚 450g,178,200
浩浩妈体重管理俱乐部,国产康宝莱奶昔正品官网旗艦店国产康宝莱蛋白营养代餐粉曲奇红豆,232,200
合生斯维健康产品企业店,斯维诗Swisse乳清蛋白粉蛋白质粉健身增肌中老年孕妇免疫营养成人,164,200
和芝源保健品专营店,汤臣倍健蛋白粉蛋白质粉男女中老年蛋白质营养粉父母长辈保健品,58,200
和芝源保健品专营店,汤臣倍健蛋白质粉中老年成人补品植物蛋白粉礼品成人男女性健康,158,200
鹤丽堂保健品专营店,蛋白质粉中老年补无糖蛋白粉中老年术后增强营养粉保健礼品鹤丽堂,176,200
鹤丽堂保健品专营店,驼奶蛋白质粉正宗新疆骆驼奶粉中老年无糖高钙营养益生菌大罐装,176,200
鹤丽堂保健品专营店,增肥蛋白质粉瘦人增重变胖产品快速长肉营养补品益生菌配方鹤丽堂,176,200
鹤丽堂保健品专营店,牛初乳蛋白粉益生菌增强营养粉补品官方旗舰店正品蛋白质粉鹤丽堂,176,200
鹤丽堂保健品专营店,驼奶蛋白质粉新疆正宗伊犁骆驼奶粉中老年高钙益生菌营养鹤丽堂,93,200
鹤丽堂保健品专营店,高钙蛋白质粉儿童中老年补钙营养粉官方旗舰店正品蛋白粉鹤丽堂,93,200
恒健大药房旗舰店,汤臣倍健胶原蛋白肽 yep胶原蛋白肽粉小分子粉瓶官旗方舰店正品带,78,200
花姐食养,花姐食养每日胶原蛋白肽粉袋5000mg日本nippi胶原蛋白正品饮品,199,200
华信旗舰店,蛋白质粉增强免疫力中老年营养术后病人官方旗舰店正品 0添加剂,63,200
肌动力运动营养,熊猫Myprotein分离乳清蛋白质粉营养健身增肌粉2.2磅补剂5.5磅,64,200
健邦特运动营养,cpt康比特炽金乳清蛋白粉5磅健身男女增肌粉蛋白质健肌营养粉whey,258,200
健邦特运动营养,ON欧普特蒙增肌粉6磅增重粉瘦人增肥蛋白质健肌粉健身3磅,143,200
健豪奶粉批发商行,到26年雅培全安素全营养配方粉蛋白香草中老年奶粉900g,209,200
健佳保健食品,2罐共900g 汤臣倍健450g+450g蛋白质粉中老年人营养粉增 强免疫力,125,200
健康星球,发1200克汤臣倍健蛋白粉(植物型)蛋白质成人中老年人营养粉正品,188,200
健美黑军健美补剂正品店,UP训练怪兽黑钻乳清蛋白粉高蛋白营养粉训练增健肌粉向上星球whey,199,200
健美黑军健美补剂正品店,CPT 康比特炽金乳清蛋白质粉酸奶味5磅WHEY健身男女增肌增重2270g,89,200
胶原妹妹,鳕鱼胶原蛋白肽三肽粉活性小分子低聚肽水解非胶囊口服液片抗糖化,79,200
京东京造旗舰店,京东京造乳清蛋白粉蛋白质粉中老年补品成人牛乳补充营养送礼正品,79,200
久康大药房旗舰店,蛋白营养粉蛋白质乳清儿童增强奶粉青少年学生可搭配补脑记忆力类,88,200
久康大药房旗舰店,钙铁锌成长蛋白质营养粉提高儿童青少年学生增强搭增高奶粉免疫力,88,200
凯利优品店,正品浓缩wpc80乳清蛋白粉wpl90分离乳清蛋白粉增重增肌健身粉原粉,15,200
康贝安health,德国双心胶原蛋白肽液态饮小分子肽粉口服液精华女正品抗美衰老,269,200
康比特官方旗舰店,康比特三健特双乳清蛋白质粉青少年儿童运动营养粉补剂官方旗舰店,199,200
康比特体育科技旗舰店,康比特锌镁支链氨基酸bcaa官方正品旗舰店健身补剂非增肌粉肌酸,89,200
康恩贝保健品专营店,康恩贝蛋白粉蛋白质粉乳清营养粉植物中老年补品男女性增强免疫力,68,200
康健优选保健品,汤臣倍健双蛋白粉蛋白质营养正品老年人男女性免疫力药房同款送礼,136,200
蓝鲸时代运动营养,肌肉科技正氮纯乳清蛋白粉健身增肌whey正氮4.4磅乳清蛋白质粉,225,200
朗悦保健品专营店,肌肉科技六星锌镁肌酸一水肌酸耐力健身补剂bcaa支链氨基酸增肌,119,200
老伟的皇冠补剂店,赛霸乳清蛋白质粉增肌健肌粉塞霸乳清蛋白粉whey补剂健身男女5磅,254,200
老钟驾到,保税仓！瑞士AVEA科技亢衰AKG氨基胶原蛋白激活冲剂到2024年11月,1980,200
龙牡旗舰店,龙牡壮骨营养棒复合蛋白棒儿童乳清蛋白粉儿童零食官方旗舰店正品,55,200
马泰时刻旗舰店,马泰时刻乳清蛋白粉whey增肌粉瘦人增重健身男分离蛋白质2磅袋装,99,200
麦斯通保健用品专营店,蛋白营养粉官方旗舰店正品老年人增强搭女性免疫力质提高胶原补品,77,200
美人鱼保健品,包邮安利纽崔莱多种植物蛋白粉770克G国产安利蛋白质营养粉免疫力,448,200
名人补剂,ON奥普帝蒙肌酸200g欧普特蒙一水肌酸蛋白粉健身男爆发力耐力增肌,95,200
奈氏力斯即优专卖店,新西兰原装进口奈氏力斯蛋白质粉植物官方旗舰店正品营养粉蛋白粉,398,200
南 京 同 仁 堂 官 网 直 售,南京同仁堂营养蛋白质粉无糖增强成人免疫力儿童官方旗舰官网正品,38,200
牛哥的补剂铺,诺特兰德tg增肌粉5磅蛋白增肌粉瘦人增肌增重1磅乳清蛋白粉健肌粉,25,200
纽特舒玛旗舰店,纽特舒玛Nutrasumma分离乳清蛋白粉中老年健康礼术后营养蛋白质粉,388,200
诺特兰德膳食营养自卖店,诺特兰德支链氨基酸BACC健身运动补剂非乳清蛋白增肌粉氮泵肌酸粉,18,200
雀巢健康科学特医食品旗舰店,雀巢肽敏舒特殊医学用途婴儿乳蛋白深度水解配方粉400g*2罐含乳糖,736,200
雀巢健康科学特医食品旗舰店,雀巢佳膳悠选特医全营养配方粉含乳清蛋白营养粉400*2罐成人优选,375,200
鹊医世家旗舰店,儿童瘦人蛋白质粉食品搭增肥增胖增重长胖长肉非快速高脂肪产品,128,200
三里补剂铺,UP训练怪兽黑钻乳清蛋白增肌营养粉男女健身训练运动高蛋白质whey,249,200
善力倍旗舰店,善力倍 白蛋白小分子肽非人血注射输液术后营养补充浓度30%白蛋白,398,200
膳力达旗舰店,膳力达德国进口短肽水解动物乳清蛋白粉术后恢复营养粉中老年健康,358,200
上善保健食品专营店,K美盾 益生菌驼乳营养粉320g蛋白营养粉益生菌驼乳营养粉官方正品,299,200
尚旺保健品专营店,氨基酸蛋白质粉增强补营养中老年人搭免疫力送父母官方旗舰店正品,75,200
深谷溪田旗舰店,深谷溪田益生菌驼奶蛋白粉学生儿童中老年成人早餐营养蛋白质粉,64,200
深谷溪田旗舰店,深谷溪田益生菌羊乳蛋白粉成人中老年儿童学生早餐营养蛋白质粉,79,200
深谷溪田旗舰店,深谷溪田益生菌羊乳蛋白粉儿童成人中老年学生营养早餐蛋白质粉,79,200
斯维诗正品企业店,swisse斯维诗新升级玻尿酸胶原蛋白肽饮品水光粉小分子血橙胶原肽,65,200
汤臣倍健爱生活保健品店,汤臣倍健蛋白粉营养粉乳清蛋白质粉增强男女中老年免疫力正品成人,239,200
汤臣倍健佰健专卖店,汤臣倍健健乐多肌酸粉纯一水肌酸蛋白健身增肌耐力非氮泵健身补剂,44,200
汤臣倍健佰健专卖店,汤臣倍健健乐多分离乳清蛋白粉健身增肌粉男女低脂高蛋白质营养粉,268,200
汤臣倍健佰健专卖店,汤臣倍健蛋白质粉老年人蛋白营养粉增强免疫力官方旗舰店正品女性,298,200
汤臣倍健官方旗舰店,汤臣倍健胶原蛋白口服液Yep高光小粉瓶胶原蛋白肽精华官方旗舰店,245,200
汤臣倍健官方旗舰店,汤臣倍健小粉瓶胶原蛋白液态饮正品口服液小分子肽粉精华饮品官旗,240,200
汤臣倍健众华朗臣专卖店,汤臣倍健胶原蛋白肽液态饮正品官方旗舰店口服液粉yep高光小粉瓶,245,200
唐寄奴只卖自己用的,胶原蛋白肽水解粉剂小分子肽粉深海鱼低聚肽粉固体饮料内服女性,283,200
天猫超市,北京同仁堂分离乳清蛋白营养粉袋装男女性青少年学生补充蛋白质,139,200
天猫超市,同仁堂胶原蛋白液态饮正品口服液燕窝肽粉小分子鱼旗舰官网官方店,79,200
天猫超市,北京同仁堂多维高钙乳清蛋白质粉营养儿童中老年人增强蛋白免疫力,108,200
天猫超市,汤臣倍健蛋白粉营养蛋白质粉增强免疫力中老年人女官方旗舰正品,734,200
天猫超市,同仁堂胶原蛋白液态饮正品口服液燕窝肽粉小分子鱼旗舰官网官方店,99,200
天猫超市,诺特兰德蛋白粉乳清蛋白质粉增肌粉男女健身营养粉官方正品,109,200
天猫超市,九芝堂燕窝胶原蛋白液态饮口服液小分子饮品鱼肽粉旗舰官方正品店,98,200
天猫超市,Swisse斯维诗水光粉胶原蛋白肽28包/盒玻尿酸透明质酸钠血橙肌肤,198,200
天猫国际自营全球超级店,【自营】雀巢Vital Proteins胶原蛋白肽粉小分子大蓝罐美国567g,439,200
天欣保健食品专营店,C益生菌驼奶中老年蛋白质粉骆驼乳营养粉儿童蛋白粉驼奶粉正品,299,200
天欣保健食品专营店,Z益生菌驼奶中老年蛋白质粉骆驼乳营养粉儿童蛋白粉驼奶粉正品,299,200
天欣保健食品专营店,X益生菌驼奶成人蛋白质粉骆驼乳营养粉儿童蛋白粉320g驼奶粉正品,299,200
同仁专柜正品,汤臣倍健蛋白粉营养蛋白质粉增强免疫中老年人女旗艦店官网正品,129,200
歪妈家的干货店官方企业店,歪妈家的干货店 胶原蛋白粉5g*30支正品肽鱼非口服液纯胶原*4盒,752,200
伟仔妈肽之恋,出口级1500克纯鳕鱼胶原蛋白肽低聚肽粉水解小分子活性伟仔妈包邮,156,200
为粉丝开的店FOR FANS THE STORE,肌肉科技六星益生菌乳清蛋白粉增肌分离纯乳清蛋白质健身高营养,139,200
为粉丝开的店FOR FANS THE STORE,临期特价乳清蛋白质粉捡漏熊猫肌肉科技分离WHEY健身蛋白增肌粉,40,200
吴江千林保健品专营店,养生堂蛋白粉分离乳清蛋白营养粉植物增强免疫力儿童中老年成人,238,200
小杰运动营养,赛霸肌酸粉300g一水肌酸粉男女健身增健肌蛋白粉爆发力耐力非氮泵,46,200
小隆人正品补剂商城,正品康比特益生菌蛋白增肌粉瘦人增重7磅健身乳清蛋白粉 官方旗舰,199,200
小牛之家,汤臣倍健蛋白粉营养粉蛋白质粉儿童中老年男女性免疫力 450g/罐*2,319,200
雅培特医营养品旗舰店,雅培全安素进口全营养粉含蛋白质肠内营养粉900g官方旗舰,1488,200
央企控股凯泰生物活性肽,北京凯泰深海鱼皮胶原蛋白肽粉500克600道高纯度小分子肽活性肽粉,26,200
养生堂旗舰店,养生堂胶原蛋白肽口服固体饮料玻尿酸Q肌烟酰胺质酸钠精华饮品,126,200
野牛家,国产康宝莱蛋白粉营养蛋白质粉官网官方旗舰店增强正品免疫力,166,200
宜康保健食品折扣店,蛋白粉汤臣I倍健蛋白质营养粉450g无糖双蛋白官方旗舰店官网正品,316,200
优美甄选食品店,汤臣倍健蛋白质粉官方旗舰正品乳清蛋白增强女性中老年免疫力营养,94,200
优美甄选食品店,斯维诗swisse纯乳清蛋白粉健身增肌中老年女性免疫力蛋白质营养粉,149,200
远子的补剂铺,AS澳都赛斯乳清蛋白粉5磅whey优追麦克斯健身奥都塞斯分离乳清,218,200
远子的补剂铺,Muscletech肌肉科技零度分离乳清蛋白粉4磅 健身增健肌粉美国正品,155,200
远子的补剂铺,EB健型增肌粉6磅 乳清蛋白质营养男女健身瘦人增重增肥健肌粉MASS,134,200
远子的补剂铺,VIKING北欧海盗水解加强分离蛋白粉5磅89%蛋白质乳清男女健身增肌,348,200
远子的补剂铺,马泰时刻乳清蛋白质粉高蛋白健身运动男女营养增健肌粉代餐2磅,85,200
运动补剂装备小店,诺特兰德三重乳清蛋白粉3重乳清分离水解乳清增肌粉健身蛋白质1磅,48,200
甄选营养食品企业店,汤臣倍健蛋白粉乳清蛋白质营养粉中老年增强官方旗舰店免疫力正品,178,200
郑州金诺生物科技,浓缩速溶乳清蛋白粉健身补剂WPC80增重增肌粉高蛋白质营养粉WPI90,58,200
卓兴保健品大卖场,汤臣倍健植物蛋白粉大豆分离蛋白质营养粉成人男女营养品官方正品,82,200
醉幻觉保健品专营店,增肌粉瘦人健身男女乳清蛋白蛋白质粉搭减脂增重养官方旗舰店正品,78,200
Allmax保健品海外旗舰店,allmax5磅天然分离乳清蛋白粉纯乳清蛋白质粉增肌粉瘦人运动无糖,658,300
feconad旗舰店,蛋白棒非0脂肪无糖减肥饱腹代餐主食餐解馋小零食食品搭减肥咖啡,19,300
goodnature海外旗舰店,澳洲swisse胶原蛋白片胶囊胶原蛋白肽粉美白抗美颜衰老液态饮正品,55,300
goodnature海外旗舰店,swisse抗糖丸美白丸内服全身白片控糖饮口服变白内调去黄去黑色素,61,300
MuscleLAB,MUTANT铁血魔兽ISO分离乳清蛋白粉拒绝乳糖不耐健身运动ISOFLEXON,418,300
MuscleLAB,美国UN优恩ISO分离乳清蛋白粉93%蛋白质营养粉健身运动增肌粉WHEY,228,300
Muscletech海外旗舰店,[上新]肌肉科技复合肌酸片健身增肌补剂非锌镁一水肌酸蛋白粉氮泵,138,300
Myprotein海外旗舰店,【罗永浩直播间】Myprotein 浓缩乳清蛋白粉1000g(2.2磅)/袋,145,300
Myprotein海外旗舰店,5.5磅 Myprotein增肌粉瘦人增重熊猫乳清蛋白质粉健身蛋白增肌粉,315,300
Nuviline海外旗舰店,法国原装进口Nuviline盈发小粉罐 头发管理男女通用,548,300
swisse官方旗舰店,Swisse斯维诗胶原水光粉透明质酸钠胶原蛋白固体饮料口服玻尿酸,398,300
swisse智引专卖店,Swisse斯维诗乳清蛋白粉免疫力营养蛋白质粉中老年人女性官方正品,149,300
wildfieldhealth旗舰店,WFH荒野健康蛋白粉便携健身乳清蛋白质粉男增肌粉小袋装 瘦人增重,98,300
阿里健康大药房,汤臣倍健蛋白质粉增强老年人蛋白营养粉免疫力官方旗舰店正品女性,119,300
阿里健康大药房,同仁堂胶原蛋白肽小分子燕窝肽粉液态饮紧致口服液官方旗舰店正品,138,300
阿里健康大药房,同仁堂蛋白粉老年人增强免疫力女性营养乳清蛋白粉官方旗舰店正品,138,300
阿里健康大药房海外店,法国美白饮美白内服亮白胶原蛋白肽液态饮抗糖丸全身美白烟酰胺丸,329,300
佰倍优旗舰店,佰倍优白蛋白肽中老年术后恢复营养品口服液非人血注射白蛋白输液,258,300
保健品批发零售部,【送杯】乳清蛋白质粉增肌粉健身男女瘦人增肌增重长肉健肌粉,18,300
豹哥的补剂店,AllMax IsoFlex水解分离乳清蛋白质粉whey 瘦人增肌重健身5磅进口,338,300
北欧海盗旗舰店,北欧海盗健身男乳清蛋白水解牛肉蛋白粉增健肌粉分离乳清蛋白质粉,488,300
藏草密语旗舰店,益生菌高钙驼奶蛋白质粉增强搭免疫力老年人补钙骨质疏松奶粉无,89,300
超人 补剂,诺特兰德乳清蛋白粉whey四重乳清蛋白质粉健身男女蛋白增肌粉5磅,195,300
宠洛洛医药旗舰店,香港养生堂益生菌高钙驼奶粉中老年儿童成人早餐营养驼奶粉C4,169,300
狄马泰斯旗舰店,Dymatize狄马泰斯水解分离纯乳清蛋白质粉营养增健肌粉身男女5磅,729,300
赋能补剂,康比特乳清蛋白粉蛋白增肌粉低脂益生菌蛋白质营养粉健身男女健肌,89,300
国肽保健食品专营店,国肽胶原肽蛋白肽粉活性肽大豆肽牛骨肽小分子复合多肽特殊膳食,699,300
国信大药房旗舰店,vitrakvi小分子活性肽正品术后大豆恢白复营胶原蛋白肽粉养饮品xc,118,300
华北普世德旗舰店,华北制药分离乳清蛋白粉蛋白质粉成人免疫力男女性健身运动营养粉,238,300
欢欢澳洲购,斯维诗Swisse纯乳清蛋白粉健身增肌中老年孕妇免疫力营养蛋白质粉,119,300
火山运动营养,VIKING北欧海盗分离乳清蛋白质粉男女运动健身增肌健肌蛋白营养粉,348,300
火山运动营养,六星益生菌增肌粉乳清蛋白瘦人增重增肌男健身六星增肌粉营养粉,40,300
肌友公社健身补剂原料,浓缩速溶乳清蛋白粉健身补剂WPC80增重增肌粉高蛋白质营养粉WPI90,56,300
嘉禾保健品特卖店,汤臣倍健双蛋白粉蛋白质营养正品老年人男女性免疫力药房同款增强,98,300
健邦特运动营养,肌肉科技六星益生菌乳清蛋白粉健身增肌粉乳清蛋白质营养粉,44,300
健康星球,450克】汤臣倍健蛋白粉450克 男女增强免疫大豆蛋白乳清双蛋白,140,300
健康源大药房旗舰店,雅培全安素900g官方旗舰店蛋白质全营养成人配方奶粉进口礼盒装克,228,300
健乐多官方旗舰店,汤臣倍健健乐多助增肌蛋白粉瘦人健身增重乳清蛋白质粉官方旗舰店,68,300
健乐多官方旗舰店,汤臣倍健健乐多乳清蛋白粉分离乳清蛋白质健身刷脂男女瘦人增肌粉,98,300
健身小肥军,健身小肥军ON欧普特蒙乳清蛋白粉WHEY奥普帝蒙蛋白质粉美国5磅,233,300
