品牌,商品,价格,购买人数
GlobalEshop海外旗舰店,中老年奶粉蛋白质粉增强提高老年人蛋白免疫力粉营养品官方旗舰店,144,9
天猫超市,汤臣倍健蛋白粉营养蛋白质粉增强免疫力老年人女性官方店正品300g,269,11
keep食品旗舰店,Keep运动蛋白粉分离乳清蛋白质健身健康增肌形营养塑肌肉瘦奶茶味,152,24
御济堂大药房旗舰店,Swisse斯维诗乳清蛋白粉营养蛋白质粉中老年人免疫力官方旗舰cs,155,27
GLGFAS海外旗舰店,GLGFAS乳清蛋白补充营养粉美国进口中老年人术后恢复放化疗免疫力,123,33
Maxines海外旗舰店,maxines乳清蛋白粉女性蛋白质粉代餐澳洲whey分离蛋白营养粉,229,50
大牌营养食品店,Swisse斯维诗蛋白粉乳清蛋白质粉女性健身增肌中老年强免疫力营养,155,50
康恩贝官方旗舰店,康恩贝分离乳清蛋白粉蛋白质粉女性健身营养补品官方旗舰店正品,89,50
三得利健康海外旗舰店,口服美白三得利进口胶原蛋白肽粉蜜露珂娜内服高浓度抗糖饮小分子,350,50
天天特卖工厂店,买1送1白云山星群增强蛋白质粉中老年人免疫力女性蛋白粉奶粉营养,41,50
熙运医疗器械专营店,极美刻育卵素复合高蛋白营养蛋白粉卵巢高龄自然指导备孕维生素,478,50
云购直销保健品生活馆,正品纽崔莱官网官方旗舰店蛋白营养粉青少年 孕妇 中老年蛋白质粉,285,50
DGI食品旗舰店,愈素匀浆膳蛋白粉低gi代餐管鼻饲流食口服肠内营养膳食补充剂老人,89,51
KatsuoStamina旗舰店,肌鲣强蛋白摇运动代餐粉便携健身乳清蛋白粉能量饱腹奶昔营养粉,9,51
orgain海外旗舰店,【囤货2罐】Orgain傲感草饲牛胶原蛋白肽粉水解小分子精华冲剂,519,51
安安优选生活馆,6667美乐家熊宝宝蛋白粉—草莓味 美乐家儿童草莓蛋白粉450克,86,51
北欧海盗旗舰店,北欧海盗bcaa支链氨基酸肌酸谷酰胺氮泵健身补剂蛋白非促睾增肌粉,187,51
兵王的补剂营,肌肉博士金分离ISOLATE乳清蛋白质粉运动增肌蛋白粉4磅,129,51
常颐生旗舰店,北京同仁堂蛋白质粉增强免疫力成人中老年女性乳清大豆动植物礼盒,107,51
大毛猪正品补剂护具放心店,ALLMAX ISONATURAL 奥迈格司纯天然白桶分离乳清代餐增肌蛋白粉,368,51
归存堂旗舰店,钙铁锌蛋白质粉中老年人搭无糖增强营养免疫力补品官方旗舰店正品,98,51
好品堂官方企业店,dha牛磺酸蛋白质粉儿童记忆力青少年学生奶粉增强营养品蛋白粉,68,51
好万家大药房旗舰店,珍贵全蛋白粉10克/袋*40小袋/罐包邮蛋白粉400克,258,51
活力达旗舰店,活力达胶原蛋白液态饮正品精华粉小分子补充鱼胶原肽口服液态饮,99,51
佳莱福保健食品旗舰店,钙铁锌牛初乳蛋白质粉可搭长高儿童奶粉增强学生免疫力乳清蛋白粉,69,51
辽小辽的店,原装进口匈牙利vitaltrend胶原蛋白肽粉弹性蛋白500g,409,51
每益佳临床营养服务中心,【多盒优惠】浦索特殊医学用途蛋白质组件配方粉蛋白粉蛋白质粉,148,51
诺特兰德冠瑞特专卖店,诺特兰德蛋白粉营养粉植物蛋白质粉乳清营养官方旗舰店正品,39,51
亲亲严选店,英贝健蛋白质粉官方旗舰店牛初乳益生菌蛋白粉1000g儿童成人男女,69,51
若海保健品专营店,多合猴头菇乳清蛋白质粉运动健身男女通用补充身体营养蛋白营养粉,128,51
膳力达橙倍康正品店,膳力达德国动植物复合蛋白质粉分离乳清病后急恢复营养补品送老人,428,51
唐氏盛泰保健食品专营店,百庆祥多营养素蛋白粉无蔗糖高钙氨基酸成老人免疫球蛋白质粉增强,158,51
天猫超市,Swisse斯维诗乳清蛋白粉+泡腾片450g*1罐+4g*20片蛋白质维生素,299,51
天猫超市,康恩贝 蛋白粉中老年营养乳清蛋白增强免疫健身保健过年送礼400g,59,51
天猫超市,汤臣倍健健乐多分离乳清蛋白粉运动健身增肌男女高蛋白营养粉低脂,638,51
天猫超市,同仁堂时光营养随身包15袋女士综合补充烟酰胺胶原蛋白粉维生素片,69,51
小可爱直销企业店,安利纽崔莱蛋白质粉安利儿童高蛋白饮品植物多维钙质蛋白质营养粉,290,51
正品保婴直销,葆婴大豆蛋白粉优莎娜蛋白质粉大豆蛋白粉USANA葆苾康官网正品,215,51
正品维生素直卖店,白云山敬修堂人参虫草乳清蛋白质粉营养液无蔗糖官方正品旗舰店,21,51
KEEPMOMENT旗舰店,Keep  Moment分离乳清88高蛋白4磅分离抹茶新冰乐KM热练系列,279,52
阿花美式生活馆,保税仓发货VEL挪威胶原蛋白肽粉深海鳕鱼胶原小分子水解精华30条,299,52
阿里健康大药房海外店,NUTREND欧洲进口诺特兰德分离乳清蛋白粉2.25kg健身男女蛋白粉5磅,398,52
奥健补剂,马泰时刻乳清蛋白粉 增肌健身蛋白质营养粉熊猫非临期捡漏特价,85,52
豹哥的补剂店,豹哥补剂 肌肉科技纯乳清蛋白粉增肌粉 健身男瘦人增肥增重5磅7磅,235,52
丰禾力健食品专营店,美国UN分离乳清蛋白质粉运动粉健身肌ISO纯分离进口营养蛋白粉5磅,239,52
海南华研厂家直售,海南华研多重弹性蛋白紧致肌肤三型胶原蛋白肽粉无添加纯原料粉,429,52
汗宇正品运动补剂店高端品,紫光优健POWERBUFF5磅乳清蛋白质粉炽炼系列三重矩阵分离浓缩水解,299,52
汗宇正品运动补剂店高端品,VIKING北欧海盗帝国乳清蛋白粉分离乳清增重增肌粉健身健肌粉5磅,283,52
河南维润生物科技,法国罗塞洛鱼胶原蛋白肽粉正品进口原粉深海鳕鱼皮提取小分子多肽,23,52
华药耀佳旗舰店,华北制药植物蛋白质粉600g中老年补品增强营养正品无糖蛋白粉,24,52
环球优品健身补给,诺特兰德牛肉蛋白粉5磅水解牛肉分离蛋白乳清增肌运动营养粉健身,189,52
肌肉博士运动营养,肌肉博士分离乳清蛋白增肌粉4磅蛋白粉低脂蛋白质粉运动健身补剂,299,52
康恩贝提橙专卖店,康恩贝蛋白质粉增强免疫力无糖乳清蛋白粉中老年人学生成人营养粉,104,52
南京同仁堂 官 网 店铺,南京同仁堂营养蛋白质粉无糖增强成人免疫力官方中老年旗舰店正品,42,52
倪氏永恒健康食品,2罐价美莱健营养蛋白质粉固体饮料1千克,80,52
妞妞的零食铺,【拍1发6】益生菌高钙驼奶蛋白粉全家适用【南京同仁堂绿金家园】,36,52
祺商保健食品折扣店,汤臣I倍健蛋白质粉600礼盒装青少年官网正品官方旗舰店学生营养粉,186,52
芊彤营养美妆店,美国安利蛋白质粉纽崔莱植物蛋白质粉儿童中老年增强免疫低脂,180,52
人人关注胃肠营养,沛可匀浆膳低蛋白型 改善肾功能营养粉管饲鼻饲中老年人代餐食品,45,52
汤臣倍健乐力店,两罐汤臣倍健蛋白粉450g成人中老年免疫力低下双蛋白营养蛋白质粉,310,52
天猫国际自营全球超级店,【自营】肌肉科技六星增肌粉益生菌瘦人增重增肌健身男乳清蛋白,71,52
鑫时代健身补剂,英国奥博力浓缩乳清蛋白粉冷滤微化蛋白0糖0脂【2024年5月到期】,65,52
亦舒堂旗舰店,豌胶饮蛋白粉旗舰店豌豆蛋白质粉中老年人成人儿童学生植物营养粉,168,52
中意健身一族补剂,包邮 L-谷氨酰胺粉500克运动健身补剂 增肌粉肌酸蛋白粉glutamine,13,52
GlobalEshop海外旗舰店,老年人蛋白增强免疫力乳铁蛋白粉无糖蛋白质营养粉官方旗舰店900g,153,53
hbuy海外旗舰店,swisse抗糖丸口服美白丸控糖内服全身亮白胶原蛋白变白内调淡斑VC,79,53
Lumi旗舰店,lumi胶原蛋白粉液态饮正品小分子肽粉口服液精华饮品官方旗舰20袋,109,53
阿里健康大药房,白云山卓悦蛋白质粉增强免疫力青少年中老年成人营养男女官方旗舰,99,53
阿里健康大药房海外店,澳洲Nature'sWay澳萃维营养香草味蛋白粉佳思敏蛋白质增免疫力,93,53
奥健补剂,STT怪兽一水肌酸高纯肌酸增肌健身增加力量爆发力非氮泵蛋白粉,49,53
大熠保健食品专营店,修正沛怡优佳复合蛋白蚕蛹粉双蛋白浓缩乳清蛋白中老年营养保健品,238,53
华北正品店,华北制药蛋白粉80%无蔗糖蛋白质粉钙铁锌乳清蛋白粉营养补品术后,158,53
肌友公社健身补剂原料,谷氨酰胺健身氨基酸L-谷氨酰胺运动健身补剂增肌粉蛋白粉缓解酸痛,14,53
健康保健食品优选店,世纪青青蛋白粉药店同款卓悦10g*50袋/盒蛋白质原粉【23年9月产,74,53
健身小肥军,健身小肥军肌肉博士金分离ISOLATE乳清蛋白质粉运动增肌蛋白粉4磅,299,53
巨人运动营养补剂正品店,mutant铁血魔兽分离乳清蛋白质粉whey男女健肌粉健身增肌粉5磅,395,53
康尔佳食品专营店,康恩贝蛋白粉无糖乳清蛋白质粉增强免疫力学生中老年营养品旗舰店,104,53
沐风营养保健食品店,修正沛怡优佳复合蚕蛹双蛋白质粉浓缩乳清蛋白粉固体饮料营养补品,65,53
汤臣倍健盈养一号专卖店,汤臣倍健蛋白质粉植物营养粉女性可搭中老年补品官方旗舰店网正品,73,53
特价临期淘母婴店,24年6月到期鹿王牌益生菌高钙鹿乳蛋白粉320克临期特价蛋白粉正品,10,53
亦康保健食品,450克 汤臣倍健蛋白质粉强免疫力成年中老年男女营养粉高蛋白乳清,138,53
GINZA银座抗衰老中心,捷克collamedic挪威冰川鳕鱼胶原蛋白肽高效蛋白粉饱满细嫩收毛孔,425,54
KANGAOLAI,【抖音同款正品】中粮小分子肽蛋白质粉可益康植物双肽蛋白营养粉,238,54
KMax康麦斯海外旗舰店,进口免疫力蛋白粉牛初乳蛋白质粉增强免疫球蛋白乳铁蛋白中老年人,558,54
阿里健康大药房,同仁堂蛋白粉中老年人女性营养蛋白质粉增强免疫力官方旗舰店正品,59,54
澳品味海外专营店,美国国产康宝莱奶昔代餐粉饱腹食品套餐蛋白营养粉美国进口正品,136,54
草本上品,国产康宝莱血橙胶原蛋白肽粉210g小分子肽水解粉非液态饮官网正品,426,54
超人 补剂,临期特价捡漏乳清蛋白粉诺特5磅海德利乳清男女健身whey增肌粉,49,54
超神运动营养补剂站,康比特充力元青少年体育生中高考体训体考运动冲力元力量爆发480g,379,54
宠洛洛医药旗舰店,TNP香港养生堂益生菌高钙驼奶蛋白粉中老年儿童,169,54
初元保健品旗舰店,江中初元加肽蛋白粉免疫力中老年人成人450g送礼盒蛋白质粉营养品,129,54
尕咩咩澳洲购,Nature'sWay澳萃维胶原蛋白粉焕颜提气色营养女士口服120g,89,54
汗宇正品运动补剂店高端品,美国ALLMAX分离乳清蛋白粉ISOFLEX高纯度水解5磅健身增肌非ON欧普,338,54
康复营养中心,立适康乳清蛋白粉 香草味 300g假一赔十正品质量保证医院药房同款,155,54
绿巨人健身健美用品,德国进口ironmaxx艾恩麦斯弗瑞格whey乳清蛋白粉营养健身增肌补剂,458,54
诺特兰德1号店,诺特兰德蛋白粉5磅原味高蛋白三重乳清蛋白质粉健身增肌增重长肉,129,54
皮特健身补剂店,Muscletech肌肉科技增肌粉瘦人增重增肌高性能白金乳清蛋白粉mass,148,54
企业直销官署店,安利纽崔莱植物蛋白粉女士大豆蛋白健身增肌粉男性运动营养400g,280,54
桥本同学互助会,豌豆蛋白粉无麸质无奶pea protein桥本食品植物蛋白粉营养粉500g,168,54
三得利健康海外旗舰店,【约90天量】suntory三得利第四代蜜露珂娜高浓度胶原蛋白粉抗糖,1006,54
善元堂旗舰店,善元堂妙语大豆乳清蛋白粉奶粉牛磺酸营养粉成人男女性增强免疫力,338,54
汤臣倍健官方旗舰店,汤臣倍健健乐多肌酸粉一健身补剂水肌酸蛋白增肌耐力非氮泵bcaa,98,54
特价母婴优选,24年6月到期临期特价蛋白粉益生菌高钙鹿乳蛋白粉固体饮料320克,11,54
同仁品牌自营店,同仁堂胶原蛋白营养粉女性蛋白质粉补品免疫力官方旗舰店官网正品,45,54
纤纤营养屋,康宝莱奶昔官网旗艦店营养蛋白粉国产正品增加饱腹感健身增肌,176,54
小杰运动营养,肌肉科技乳清蛋白粉便携装小袋装益生菌试用装六星蛋白增肌粉whey,59,54
小牛之家,汤臣倍健蛋白粉营养蛋白质粉礼盒中老年 免疫 提高 2罐600g,209,54
型男健身馆官方店,乳清蛋白恒天然增肌增重健身补剂动物蛋白质营养粉wpc80原味袋装,55,54
营养品服务中心,立适康高蛋白全营养粉固体饮料360g院内同款 新日期,125,54
悦活360健康生活馆,纽斯葆 牌蛋白质粉 450g/罐+10g/袋*16袋,118,54
云购(商城),Amway安利纽崔莱蛋白质粉提升青少年中老年孕妇免疫力蛋白营养粉,279,54
goldensun金日旗舰店,金日牌高营养蛋白质粉480g男女通用成人动植物蛋白营养粉礼盒装,179,55
ToneItUp海外旗舰店,toneitup有机植物蛋白粉女叟身运动低糖健身蛋白质粉进口营养补充,288,55
阿里健康大药房,仁和蛋白质营养蛋白粉提高增强成人官方旗舰店正品非老年人免疫力,89,55
奥健补剂,【90%蛋白含量】STT怪兽纯分离乳清蛋白粉WHEY增肌蛋白质营养粉,299,55
吃蓝莓的熊猫,顺丰 现芬兰Foodin有机草饲乳清蛋白粉 无添加高品质氨基酸健身,265,55
大青蛙营养俱乐部,香港康宝莱奶昔 营养代餐粉 官网正品 蛋白混合饮料 饱腹感国版,267,55
蒂芬妮官方旗舰店,蒂芬妮胶原蛋白粉液态饮正品原液补充精华口服鱼胶原肽水解粉,138,55
禾博士旗舰店,禾博士乳清蛋白质粉+维C中老年人营养品维生素矿物质双蛋白粉vc,89,55
极动公馆丨运动补剂商城,熊猫Myprotein分离乳清蛋白质粉营养健身增肌粉2.2磅补剂5.5磅,128,55
健美黑军健美补剂正品店,BD必第能量乳清蛋白粉5磅健身增肌蛋白质粉非肌酸氨基酸健身乳清,199,55
巨人运动营养补剂正品店,mutant铁血魔兽乳清蛋白质粉 whey健身男女增肌粉健肌粉增重粉5磅,270,55
康恩贝雄起专卖店,康恩贝蛋白粉乳清蛋白质粉营养中老年人增强免疫力官方旗舰店正品,49,55
康健优选保健品,汤臣倍健yep高光磁感小粉瓶5瓶装胶原蛋白液态饮正品口服液小分子,51,55
康益莱保健品专营店,修正正品蛋白粉乳清蛋白质粉老年人增强免疫力儿童维生素C铁沛怡,198,55
苏宁易购官方旗舰店,Swisse斯维诗乳清蛋白粉 蛋白质粉中老年健身营养粉礼盒3104,159,55
天猫超市,活动咨询汤臣倍健蛋白质粉植物蛋白营养品男女成人官方旗舰正品店,297,55
天猫超市,fiboo代餐奶昔粉蛋白代餐饱腹食品早晚餐营养主食速食冲饮代餐粉,199,55
维塑营养企业店,维塑乳清蛋白粉3磅 健身增肌男女无糖WHEY锌镁营养蛋白质增健肌粉,109,55
吴越老百姓大药房旗舰店,浦索水解蛋白液特殊短肽医学用途蛋白质组件配方营养粉dy4,188,55
小隆人正品补剂商城,EB健型增肌粉6磅 瘦人增重吃胖强化体格乳清蛋白质营养粉原装正品,158,55
姿彩生活馆,马来安利成人多种植物蛋白粉900g家庭装（24年09月到期）,358,55
Allmax保健品海外旗舰店,ALLMAX乳清蛋白质粉健身健肌运动瘦人增肌粉金标纯乳清蛋白营养粉,278,56
Myprotein海外旗舰店,11磅 Myprotein增肌配方粉瘦人增重熊猫蛋白质增肌粉健身男女补剂,410,56
阿里健康大药房,同仁堂肌酸一水肌酸粉非氮泵蛋白粉耐力爆发力健身增肌粉,69,56
阿里健康大药房,美国胶原蛋白片肽精华液态粉口服饮品丸全身旗舰店正品搭美白内服,168,56
健佳保健食品,汤臣倍健乳清蛋白固体饮料400g 纯动物蛋白 增肌 香草味蛋白质粉,125,56
巨人运动营养补剂正品店,OXYENERGY氧气能量乳清蛋白质粉试用装ISO分离乳清whey粉健身食,20,56
亮轻盈保健品旗舰店,亮轻盈 燕窝肽胶原蛋白肽饮 粉瓶维C鱼胶原血橙口服液精华饮套餐,99,56
木圣闻健康食化,日本鲣鱼弹性蛋白肽林兼纯粉进口原料增加肌肤弹性胶原蛋白搭档,95,56
品牌特惠国内总店,康笑莱无蔗糖高钙蛋白质营养粉蛋白粉中老年人补钙官方旗舰店正品,40,56
企业直销云店,安利纽崔莱益源植物蛋白质粉增强青少年中老年人蛋白营养粉免疫力,428,56
权baobaoの代购小铺,日本明治胶原蛋白粉粉色袋装196g内调28日替换送勺子包邮,113,56
汤臣倍健健领专卖店,汤臣倍健蛋白粉高蛋白质乳清营养中老年成人增强免疫力官方旗舰店,674,56
天猫国际全球探物,澳大利亚直邮Nestle雀巢大蓝罐vitalproteins牛胶原蛋白肽粉284g,169,56
万疆保健食品,30袋起汤臣倍健胶原蛋白粉烟酰胺水蜜桃进口法国鱼胶原蛋白肽果饮,83,56
威士雅保健品旗舰店,威士雅蛋白粉600g增强免疫力大豆乳清蛋白质营养粉成人,268,56
吴越老百姓大药房旗舰店,优力加蛋白粉大豆蛋白乳清蛋白质营养粉增强免疫力正品旗舰店dy5,89,56
小隆人正品补剂商城,肌肉科技分离乳清蛋白粉750g双重高纯蛋白质低糖低脂健身增肌健形,158,56
欣怡喵海外购,美国蛋白质粉中老年大罐青少年安正品利纽崔莱蛋白营养粉孕妇900G,183,56
益品达健食品旗舰店,益品达健胶原蛋白口服液烟酰胺虾青素精华小分子液态弹性时光饮,499,56
中粮保健品旗舰店,中粮胶原蛋白粉胶原蛋白肽口服水解官方非液态饮口服液旗舰店正品,158,56
卓叔瘦人增重店,卓叔增重【90%分离乳清】加拿大ALLMAX蛋白质粉健身增肌0乳糖WHEY,348,56
Chodown肆吃补剂,马泰时刻增肌粉健身瘦人增重健肌粉乳清蛋白运动营养粉2.5磅,48,57
阿里健康大药房,每优健萃 乳清蛋白粉健身增肌蛋白质粉便携营养补充瘦人男女运动,158,57
北欧海盗旗舰店,北欧海盗帝国乳清蛋白增肌粉健身男水解分离乳清运动营养蛋白质粉,488,57
黄金搭档官方旗舰店,黄金搭档中老年人男女性动植物蛋白质粉营养品官方旗舰店正品礼盒,154,57
肌肉英雄运动营养,诺特兰德TG增肌粉乳清蛋白质粉瘦人健身增肌营养粉增重男健肌粉,65,57
简朗保健食品专营店,北京同仁堂乳清蛋白质粉老年人营养粉增强免疫力粉官方旗舰店正品,89,57
健邦特运动营养,肌肉科技六星分离乳清蛋白粉健身运动分离乳清蛋白增肌蛋白质健身,119,57
康健优选保健品,汤臣倍健蛋白质粉大豆豌豆植物蛋白粉营养男女补充健康正品送礼,84,57
南苜蓿保健品专营店,DHA蛋白质粉儿童青少年增强营养搭免疫力记忆奶粉官方旗舰店正品,88,57
纽约阳光直销店,国产康宝莱进阶套餐 奶昔蛋白粉纤维素片茶饮葡萄籽 官网旗舰正品,1429,57
若海保健品专营店,多合青少年蛋白质粉学生疫力DHA蛋白粉免儿童高中营养品早餐增强,128,57
深谷溪田旗舰店,深谷溪田益生菌羊乳蛋白粉儿童学生成人中老年早餐营养蛋白质粉,79,57
汤臣营养品企业店,汤臣倍健胶原蛋白肽液态饮小分子精华粉瓶女正品口服液官方旗舰店,108,57
唐氏盛泰保健食品专营店,同仁堂绿金家园蛋白质粉专老年人无糖乳清增强营养植物糖尿人用,168,57
天猫国际自营全球超级店,【自营】ALLMAX纯分离乳清蛋白粉蛋白质粉瘦人运动健身增肌粉营养,348,57
益百岁保健食品店,深谷溪田益生菌羊乳蛋白质粉羊奶粉儿童学生中老年人成人营养粉,9,57
远子的补剂铺,赛霸乳清蛋白粉健身增肌分离蛋白质粉补剂whey增肥增重健肌粉男女,139,57
ALLMAXNUTRITION赋力专卖,ALLMAX分离乳清蛋白粉纯乳清蛋白质粉增肌粉瘦运动乳糖不耐受选我,368,58
Lumi旗舰店,Lumi胶原蛋白粉Pink粉7袋小分子鱼胶原蛋白粉 7日份量正品,19,58
Muscletech海外旗舰店,肌肉科技蛋白粉4磅水解分离乳清蛋白质粉健身男增肌粉官方旗舰店,298,58
orgain海外旗舰店,【强体质大罐装】Orgain傲感有机植物豌豆蛋白粉营养全家补充920g,350,58
orgain海外旗舰店,【强体质2罐】Orgain傲感有机植物豌豆蛋白粉全家营养提升抵御力,389,58
艾瑞堡品牌企业店,艾瑞堡分离乳清蛋白质粉营养品中老年健康礼品术后疗放化蛋白质粉,158,58
傲凡良品,傲凡瓶装粉 法国原料多维胶原蛋白肽 含透明质酸弹性蛋白抗糖化,258,58
奥健补剂,马泰时刻MASS增肌粉健身增重乳清蛋白粉北欧诺特特价捡漏不临期,68,58
白云山严选正品,养生堂牌蛋白营养粉蛋白质粉种氨基酸增强中老年成人免疫力养身堂,69,58
保健中心云店,完美营养餐螺旋藻南瓜粉 早餐蛋白粉代餐正品专卖官网,107,58
国药中华老字号,北京同仁堂胶原蛋白肽口服液燕窝海参粉正品女性白官网官方旗舰店,27,58
火山运动营养,马泰时刻支链氨基酸粉bcaa电解质粉健身运动非氮泵肌酸乳清蛋白粉,29,58
健邦特运动营养,肌肉科技六星益生菌增肌粉瘦人增重增肌增肌粉乳清蛋白质粉,41,58
麦麦化妆品正品直销店,欧瑞莲瑞尔姿蛋白粉虾青素鱼油多维钙片活力套装体重管理官网正品,29,58
名人补剂,Muscletech肌肉科技白金乳清蛋白粉男女健身营养增肌分离蛋白质粉,185,58
纳维康保健品专营店,UN美国优恩ISO纯分离乳清蛋白蛋白质粉瘦人增肌增重粉健身男5磅,259,58
暖蔻旗舰店,暖蔻寇蛋白粉寇水解乳清蛋白粉补充营养能量运动增肌官方正品旗舰,188,58
桃白白旗舰店,999桃白白胶原蛋白肽氨基丁酸口服液蛋白肽内调正品旗舰店小粉瓶,209,58
天猫超市,康比特分离乳清蛋白750g运动健身健美whey低脂瘦人增重蛋白增肌粉,438,58
吴越老百姓大药房旗舰店,汤臣倍健蛋白质粉乳清官方旗舰店正品 中老年增强免疫力营养粉 XD,159,58
小黄鸭保健食品店,康恩贝蛋白粉80%蛋白质营养健身增肌中老年成人儿童送礼正品,40,58
小姐姐全球优选,澳洲Nature's Way佳思敏蛋白质粉速溶营养健身原味香草巧克力375g,78,58
壹品生物科技,美国wpi90分离乳清蛋白质粉新西兰浓缩WPC80乳清蛋白健身增肌原粉,49,58
以琳养生铺子,modomodo鳕鱼胶原蛋白肽人体胶原蛋白原料小分子肽活性肽正品,99,58
远子的补剂铺,澳洲Maxines乳清蛋白粉女性健身塑型增肌代餐食品饱腹WHEY蛋白粉,219,58
中航生物科技企业店,Hilmar9410分离乳清蛋白粉WPI90浓缩乳清蛋白粉wpc80健身增重增肌,45,58
大熠保健食品专营店,修正维生素C加铁蛋白质粉中老年增强免疫力大豆营养维e粉沛怡成人,268,59
广锦堂旗舰店,益生菌驼奶蛋白粉中老年青少年男女性营养粉骆驼奶粉乳清蛋白质粉,35,59
华北满熙专卖店,华北制药益生菌高蛋白质粉乳清无糖蛋白营养粉男女性中老年蛋白粉,143,59
加美宝贝加拿大正品代购,加拿大直邮LeanFit乳清蛋白粉营养保健 香草和巧克力两种口味2Kg,313,59
麦麦化妆品正品直销店,官网正品欧瑞莲瑞尔姿复合蛋白粉固体饮料玉米草莓香草原味营养品,5,59
诺特兰德1号店,OXYENERGY氧气能量乳清蛋白粉体验装芝芝桃桃味试用装蛋白质成人,69,59
企业直销云店,安利纽崔莱植物蛋白质全营养粉增强男女术中老年人蛋白免疫力粉,280,59
天猫国际自营全球超级店,【自营】BSN乳清蛋白质粉Syntha-6六重矩阵蛋白粉进口健身增肌5磅,388,59
唯一食品特产,浓缩分离乳清蛋白粉健身补剂WPC80增肌增重粉速溶蛋白质粉营养粉,13,59
武汉国大大药房旗舰店,汤臣倍健乳清蛋白粉营养粉营养品女性中老年人成人健身官方旗舰店,139,59
纤妍保健食品专营店,中老年人益生菌蛋白质营养粉官方旗舰店正品蛋白增强非免疫力无糖,78,59
鑫时代健身补剂,Myprotein熊猫乳清蛋白粉茉莉绿茶玄米茶烘焙茶新品增肌拿铁奶茶,69,59
旭玖康保健食品企业店,旭玖康分离乳清蛋白粉中老年乳清蛋白成人术后恢复动物蛋白营养粉,458,59
益丰大药房旗舰店,2盒送礼品袋】优力加 百合康牌蛋白粉 10g*50袋/罐 增强免疫力,89,59
远子的补剂铺,OXYENERGY氧气能量乳清蛋白质粉whey分离乳清营养健身增健肌粉5磅,178,59
爱肾网,爱肾网 费瑞能透析蛋白粉分离乳清蛋白质复合粉0磷0钾透析营养粉,169,60
德中康桥 正品代购,2026年新日期！ 新包装罐装 德国原装进口Caelo骨胶原蛋白粉 750g,185,60
汗宇正品运动补剂店高端品,赛霸增肌粉5磅复合三重乳清蛋白粉瘦人增重健身男增肌蛋白质粉,139,60
健佳保健食品,汤臣倍健学生蛋白质粉水果味600g青少年男女儿童营养品免疫力正品,129,60
康尔佳食品专营店,康恩贝氨基酸片成人中老年增强免疫力正品官方旗舰店可搭蛋白质粉,45,60
康莲食品,买一送二小 威士雅牌蛋白粉双蛋白乳清蛋白质粉共1130克免疫力,190,60
丽格沛小分子肽,马来西亚原装进口小分子肽丽格沛胶原蛋白冲剂紧致光泽弹性非口服,169,60
绿生堂营养品商城,复合营养氨基酸蛋白质粉中老年人搭强体质免疫术后营养补品送礼,65,60
名人补剂,名人补剂肌肉科技分离乳清蛋白粉六星益生菌蛋白增肌粉男运动健身,200,60
名人补剂,肌肉科技乳清蛋白质粉临期康比特增肌粉特价ON蛋白粉捡漏诺特兰德,65,60
